top_reference,total_count
"bourdieu p., boltanski l., castel r., chamboredon j.-c., schnapper d., photography: a middle-brow art, (1990)",5
"bourdieu p., el sentido práctico, (1991)",5
"bourdieu p., the field of cultural production, or: the economic world reversed, the field of cultural production: essays on art and literature, pp. 29-73, (1983)",5
"bourdieu p., masculine domination revisited, berkeley journal of sociology, 41, pp. 189-203, (1997)",5
"bourdieu p., wacquant l., réponses, (1992)",5
"bourdieu p., accardo a., balazs g., et al., the weight of the world. social suffering in contemporary society, (1999)",5
"bourdieu p., réponses. pour une anthropologie réflexive, (1992)",5
"bourdieu p., (1977)",5
"bourdieu p., the logic of practice (translated by richard nice), (1990)",5
"bourdieu p., the forms of capital, handbook of theory and research in education, pp. 241-258, (1986)",4
"bourdieu p., from rules to strategies: an interview with pierre bourdieu, cultural anthropology, 1, pp. 110-120, (1986)",4
"bourdieu p., the historical genesis of a pure aesthetic, journal of aesthetics and art criticism, 46, pp. 201-210, (1987)",4
"bourdieu p., vive la crise!, theory and society, 17, 5, pp. 773-787, (1988)",4
"bourdieu p., the logic of practice",4
"bourdieu p., coleman j.s., social theory for a changing society, (1991)",4
"bourdieu p., et al., l'amour de l'art. les musées d'art européens et leur public, (1966)",4
"bourdieu p., ökonomisches kapital, kulturelles kapital, soziales kapital, soziale ungleichheiten, sonderband 2, soziale welt, pp. 183-198, (1983)",4
"bourdieu p., sur le pouvoir symbolique., annales, 3, pp. 405-411, (1977)",4
"bourdieu p., marginalia-some additional notes on the gift, the logic of the gift: toward and ethic of generosity, pp. 231-241, (1997)",4
"bourdieu p., habitus, code et codification, actes de la recherche en sciences sociales, 64, 1, pp. 40-44, (1986)",4
"bourdieu p., utopia of endless exploitation: the essence of neoliberalism, le monde diplomatique, (1998)",4
"bourdieu p., boltanski l., saint-martin m.d., les stratégies de re-conversion. les classes sociales et le système d’enseignement, informations sur les sciences sociales, 12, 5, pp. 61-113, (1973)",4
"bourdieu p., some properties of fields, sociology in question, (1993)",4
"bourdieu pierre, from the king’s house to the reason of state: a model of the genesis of the bureaucratic field, constellations, 11, 1, pp. 16-36, (2004)",4
"bourdieu p., sociology in question, pp. 72-77, (1993)",4
"bourdieu p., passeron c., reproduction in society, education and culture, (1977)",4
"bourdieu p., sozialer sinn. kritik der theoretischen vernunft, (1987)",4
"bourdieu p., darbel a., schnapper d., the love of art, (1990)",4
"bourdieu p., men and machines, advances in social theory and methodology, pp. 304-317, (1981)",4
"bourdieu p., a lecture on the lecture, in other words: essays towards a reflexive sociology, pp. 177-198, (1990)",4
"bourdieu p., the specificity of the scientific field and the social conditions of the progress of reason, the science studies reader, pp. 31-50, (1999)",4
"bourdieu p., révolution dans la révolution, esprit, 1, pp. 27-40, (1961)",4
"bourdieu p., le bal des célibataires, (2002)",4
"bourdieu p., et al.,  the abdication of the state,, the weight of the world: social suffering in contemporary society, pp. 181-188, (1999)",4
"bourdieu p., contre-feux 2, (2001)",4
"bourdieu p., remarques provisoires sur la perception sociale du corps, actes de la recherche en sciences sociales, 14, pp. 51-54, (1977)",4
"bourdieu p., marriage strategies as strategies of social reproduction, family and society. selections from the annales. economoes, sociétiés, civilisations, pp. 117-144, (1976)",4
"bourdieu p., boltanski l., le titre et le poste. rapports entre le système de production et le système de reproduction, actes de la recherche en sciences sociales, 2, pp. 95-107, (1975)",4
"bourdieu p., eléments d'une théorie sociologique de la perception artistique, revue internationale des sciences sociales, 20, 4, pp. 640-664, (1968)",4
"bourdieu p., boltanski l., le fétichisme de la langue, actes de la recherche en sciences sociales, 1, 4, pp. 1-32, (1975)",4
"bourdieu p., the forms of capital.” pp. 241–258, handbook of theory and research for the sociology of education, (1986)",4
"bourdieu p., the biographical illusion, identity, pp. 297-303, (2000)",4
"bourdieu p., sociologie générale: cours au collège de france 1981-1983, (2015)",4
"bourdieu p., la dominación masculina, (2000)",4
"bourdieu p., esprits d'état. genèse et structure du champ bureaucratique, actes de la recherche en sciences sociales, 96-97, pp. 49-62, (1993)",4
"bourdieu p., passeron j.-c., de saint martin m., academic discourse: linguistic misunderstanding and professorial power, (1994)",4
"bourdieu p., the forms of capital, education, globalization and social change, pp. 105-118, (2006)",4
"bourdieu p., passeron j.c., reproduction in education, society and culture. translated by richard nice, (1990)",4
"bourdieu p., on symbolic power, language and symbolic power, pp. 163-170, (1991)",4
"bourdieu p., systems of education and systems of thought, social science information, 14, pp. 338-358, (1967)",3
"bourdieu p., espace sociale et genèse des “classes”, actes de la recherche en sciences sociales, 53-54, pp. 3-12, (1984)",3
"bourdieu p., distinction: a critique of the social judgement of taste, (1986)",3
"bourdieu p., systems of education and systems of thought, schooling and capitalism: a sociological reader, (1976)",3
"bourdieu p., power and ideology in education, (1977)",3
"bourdieu p., les stratégies matrimoniales dans le système de reproduction, annales, 27, 4-5, pp. 1105-1127, (1972)",3
"bourdieu p., wacquant l., introduction to reflexive sociology, (1992)",3
"bourdieu p., towards a theory of practice, (1977)",3
"bourdieu p., l'opinion publique n'existe pas, les temps modèrnes, 318, pp. 1292-1309, (1973)",3
"bourdieu p., collins r., the production of belief: contribution to an economy of symbolic goods’, in, media, culture and society: a critical reader., (1977)",3
"bourdieu pierre, sayad abdelmalek, colonial rule and cultural sabir, ethnography, 5, 4, pp. 544-86, (1964)",3
"bourdieu p., handbook of theory and research for the sociology of education, 'the forms of capital', (1986)",3
"bourdieu p., passeron j.c., martin m.d.s., academic discourse, (1965)",3
"bourdieu p., bourdieu: a critical reader, pp. 220-228, (1999)",3
"bourdieu p., thompson j., raymond g., adamson m., language and symbolic power, (1991)",3
"bourdieu p., preface, the suffering of the immigrant, (2004)",3
"bourdieu p., la spécificité du champ scientifique et les conditions sociales du progrès de la raison, sociologie et sociétés, 7, 1, pp. 91-118, (1975)",3
"bourdieu p., les usages sociaux de la science, pour une sociologie clinique du champ scientifique, (1999)",3
"bourdieu p., l’opinion publique n’existe pas, questions de sociologie, pp. 222-235, (1980)",3
"bourdieu p., la distinction: critique sociale du jugement. sens commun, (1979)",3
"bourdieu p., forms of capital. handbook of theory and research for the sociology of education. j. richardson, (1986)",3
"bourdieu p., on television, (2011)",3
"bourdieu p., gegenfeuer: wortmeldungen im dienste des widerstands gegen die neoliberale invasion, (1998)",3
"bourdieu p., et al., das elend der welt: zeugnisse und diagnosen alltäglichen leidens an der gesellschaft, (1997)",3
"bourdieu p., marginalia - some additional notes on the gift, the logic of the gift, (1997)",3
"bourdieu p., cultural reproduction and social reproduction, pp. 487-510, (1977)",3
"bourdieu p., pascalian meditations, trans. r. nice, (2000)",3
"bourdieu p., die regeln der kunst. genese und struktur des literarischen feldes, (1999)",3
"bourdieu p., distinction, (2000)",3
"bourdieu p., sport and social class, rethinking popular culture, pp. 357-373, (1991)",3
"bourdieu p., ‘youth’ is just a word, sociology in question, pp. 94-102, (1993)",3
"bourdieu p., outline of a sociological theory of art perception, the field of cultural production: essays on art and literature, pp. 215-237, (1968)",3
"bourdieu p., the market of symbolic goods, the field of cultural production: essays on art and literature, pp. 112-141, (1976)",3
"bourdieu p., cultural power, cultural sociology, pp. 69-76, (2002)",3
"bourdieu p., contre-feux 2. pour un mouvement social européen, (2001)",3
"bourdieu p., le choc des civilizations, le sous-développement en algérie, pp. 52-64, (1959)",3
"bourdieu p., étude sociologique, travail et travailleurs en algérie, pp. 251-389, (1963)",3
"bourdieu p., le champ littéraire, actes de la recherche en sciences sociales, 89, 1, pp. 3-46, (1991)",3
"bourdieu p., le fonctionnement du champ intellectuel, regards sociologiques, 17-18, pp. 5-27, (1999)",3
"bourdieu p., o poder simbólico, (1989)",3
"bourdieu p., la force du droit: éléments pour une sociologie du champ juridique, actes de la recherche en sciences sociales, 42, pp. 3-19, (1986)",3
"bourdieu p., capital cultural, escuela y espacio social, (1997)",3
"bourdieu p., distinction: a social critique of judgement, (1986)",3
"bourdieu p., rites of institution, language and symbolic power, (1993)",3
"bourdieu p., sociologie générale, 1, (2015)",3
"bourdieu p., passeron j.-claude., reproduction in education, society and culture, 2nd edn., (1990)",3
"bourdieu p., the biographical illusion, working papers and proceedings of the center for psychosocial studies, 14, pp. 3-7, (1987)",3
"bourdieu p., une interprétation de la théorie de la religion selon max weber, european journal of sociology/archives européennes de sociologie, 12, 1, pp. 3-21, (1971)",3
"bourdieu p., habitus, habitus: a sense of place, (2005)",3
"bourdieu p., de saint martin m., la sainte famille. l'épiscopat françcais dans la champ du pouvoir, actes de la recherche en sciences sociales, 44-45, pp. 2-53, (1982)",3
"bourdieu p., the specificity of the scientific field and the social conditions of the progress of reason, information (international social science council), 14, 6, pp. 19-47, (1975)",3
"bourdieu p., condition de classe et position de classe, archives européennes de sociologie, 7, 2, pp. 201-223, (1966)",3
"bourdieu p., forms of capital, handbook of the sociology of education, pp. 241-258, (1983)",3
"bourdieu p., systems of education and systems of thought, international social science journal, 19, 3, pp. 338-358, (1967)",3
"bourdieu p., programme for a sociology of sport, in other words, (1987)",3
"bourdieu p., die feinen unterschiede, (1982)",3
"bourdieu p., sayad a., le déracinement. la crise de l'agriculture traditionnelle en algérie (the uprooting: the crisis of traditional agriculture in algeria), (1964)",3
"bourdieu p., the craft of sociology, (1991)",3
"bourdieu p., the biographical illusion, identity: a reader, (2000)",3
"bourdieu p., les rites comme actes d'institution, actes de la recherche en sciences sociales, 43, pp. 58-63, (1982)",3
"bourdieu p., de saint martin m., anatomie du goût, actes de la recherche en sciences sociales, 5, 2, pp. 2-81, (1976)",3
"bourdieu p., sozialer raum und klassen, leǎon. sur la leǎon. zwei vorlesungen, (1985)",3
"bourdieu p., la précarité est aujourd’hui partout, contre-feux, pp. 95-101, (1998)",3
"bourdieu p., kulturelle reproduktion und soziale reproduktion, grundlagen einer theorie der symbolischen gewalt, pp. 88-137, (1973)",3
"bourdieu p., the production of belief: contribution to an economy of symbolic goods, the field of cultural production: essays on art and literature, pp. 74-111, (1993)",3
"bourdieu p., from the king’s house to the reason of state, constellations, 99, 1, pp. 16-36, (2004)",3
"bourdieu p., manet, (2017)",3
"bourdieu p., la distinction: critique social du jugement (distinction: a social critique of taste), (1979)",3
"bourdieu p., guerre et mutation sociale en algérie, études méditerranéennes, 7, spring, pp. 25-37, (1960)",3
"bourdieu p., une classe objet, actes de la recherche en sciences sociales, 17, 18, (1977)",3
"bourdieu p., reproduction interdite. la dimension symbolique de la domination économique, études rurales, 113-114, january-june, pp. 15-36, (1989)",3
"bourdieu p., participant objectivation: the huxley medal lecture, journal of the royal anthropological institute, 9, 2, pp. 281-294, (2003)",3
"bourdieu p., the essence of neoliberalism: what is neoliberalism? a programme for destroying collective structures which may impede the pure market logic, le monde diplomatique, (1998)",3
"bourdieu p., images d'algérie. une affinité élective, (2003)",3
"bourdieu p., darbel a., schnapper d., l'amour de l'art, (1966)",3
"bourdieu p., the kabyle house or the world reversed, the logic of practice, (1992)",3
"bourdieu p., die männliche herrschaft, (1998)",3
"bourdieu p., passeron j.c., la reproducción: elementos para una teoría del sistema de enseñanza, (1996)",3
"bourdieu p., the theory of practice, (1980)",3
"bourdieu p., the practice of reflexive sociology (the paris workshop), an invitation to reflexive sociology, (1992)",3
"bourdieu p., accardo a., balazas g., beaud s., bonvin f., bourdieu e., bourgois p., broccolichi s., champagne p., christin r., faguer j.p., garcia s., lenoir r., oeuvrard f., pialoux m., pinto l., podalydes d., sayad a., soulie c., wacquant j.d., the weight of the world: social suffering in contemporary society (p. p. ferguson, trans.), (2000)",3
"bourdieu p., décrire et prescrire. note sur les conditions de possibilité et les limites de l'efficacité politique, actes de la recherche en sciences sociales, 38, pp. 69-73, (1981)",3
"bourdieu p., the specificity of the scientific field and the social conditions of the progress of reason, social science information/information sur les sciences sociales, 14, 6, pp. 19-47, (1975)",3
"bourdieu p., ragioni pratiche, (2009)",3
"bourdieu p., academic discourse, (1994)",3
"bourdieu p., distinction: a social critique of the stratification of taste, (1984)",3
"bourdieu p., the forms of capital, sociology of education: a critical reader, pp. 83-95, (2007)",3
"bourdieu p., classification struggles: general sociology, vol. i, lectures at the college de france 1981-1982, (1982)",3
"bourdieu p., foreword, dealing in virtue: international commercial arbitration and the construction of a transnational legal order, (1996)",3
"bourdieu p., méditations pascaliennes [pascalian meditations], (1997)",3
"bourdieu p., a propos de la famille comme catgorie ralise, actes de la recherche en sciences sociales, 100, pp. 32-6, (1993)",3
"bourdieu p., public opinion does not exist, communication and class struggle, (1979)",3
"bourdieu p., how can one be a sports fan?, the cultural studies reader, pp. 427-440, (1999)",3
"bourdieu p., the essence of neoliberalism, le monde diplomatique, (1998)",3
"bourdieu p., the logic of fields, an invitation to reflexive sociology, pp. 94-114, (1992)",3
"bourdieu p., on symbolic power, language and symbolic power, (1992)",3
"bourdieu p., le sens pratique (the logic of practice), (1980)",3
"bourdieu p., l'ontologie politique de martin heidegger, actes de la recherche en sciences sociale, 5-6, pp. 109-156, (1975)",3
"bourdieu p., la lecture de marx: quelques remarques critiques à propos de quelques remarques critiques à propos de «lire le capital», actes de la recherche en sciences sociales, 5-6, pp. 65-79, (1975)",3
"bourdieu p., l'invention de la vie d'artiste, actes de la recherche en sciences sociales, 2, pp. 67-94, (1975)",3
"bourdieu p., the state, economics and sport, france and the 1998 world cup: the national impact of a world sporting event, pp. 15-21, (1999)",3
"bourdieu p., intellectual field and creative project, knowledge and control, (1971)",3
"bourdieu p., une interprétation de la théorie de la religion selon max weber, european journal of sociology, 12, 1, pp. 3-21, (1971)",3
"bourdieu p., sociology is a martial art: political writings by pierre bourdieu, (2010)",3
"bourdieu p., the politics of protest: an interview by kevin ovenden, socialist review, 242, pp. 18-20, (2000)",3
"bourdieu p., ‘on the possibility of a field of world sociology, social theory for a changing society, pp. 373-387, (1991)",3
"bourdieu p., passport to duke, metaphilosophy, 28, 4, pp. 449-455, (1997)",3
"bourdieu p., “rethinking the state: genesis and structure of the bureaucratic field.” translated by loïc wacquant and samar farage, sociological theory, 12, 1, pp. 1-18, (1994)",3
"bourdieu p., the school as a conservative force: scholastic and cultural inequalities, (1974)",2
"bourdieu p., comment peut-on être sportif?, questions de sociologie, (1980)",2
"bourdieu p., the invention of the artist’s life, yale french studies, 73, pp. 75-103, (1987)",2
"bourdieu p., flaubert's point of view, critical inquiry, 14, pp. 539-562, (1988)",2
"bourdieu p., sport and social class, (1977)",2
"bourdieu p., language and symbolic power, harvard university press, (1991)",2
"bourdieu p., knowledge, education and cultural change, (1973)",2
"bourdieu p., the berber house, rules and meanings, pp. 98-110, (1970)",2
"bourdieu l., passeron j., reproduction, (1977)",2
"bourdieu, outline of a theory of practice, pp. 29-30, (1977)",2
"bourdieu p., l'emprise du journalisme, actes de la recherche en sciences sociales, 101-2, pp. 3-9, (1994)",2
"bourdieu p., passeron j.-c., the inheritors: french students and their relation to culture, translated by richard nice, (1979)",2
"bourdieu p., the scholastic point of view",2
"bourdieu, darbel, schnapper, l'amour de l'art: les musées d'art européens et leur public, (1966)",2
"bourdieu, passeron, chamboredon, le métier de sociologue, (1968)",2
"bourdieu p., den maskuline dominans [the masculine domination], (2000)",2
"bourdieu p., the state, economics, and sport, france and the 1998 world cup, pp. 15-21, (1999)",2
"bourdieu p., the disenchantment of the world, algeria 1960, (1979)",2
"bourdieu p., social space and symbolic space, contemporary sociological theory, pp. 335-344, (2012)",2
"bourdieu p., the left hand and the right hand of the state, acts of resistance: against the tyrannies of the market, pp. 1-11, (1998)",2
"bourdieu p., habitus and field. general sociology, volume 2. lectures at the collège de france (1982–1983), (2020)",2
"bourdieu p., la societè traditionelle: attitude à l’egard du temps et counduite èconomique, sociologie du travail, 1, s, pp. 24-44, (1963)",2
"bourdieu p., for a scholarship with commitment, profession, pp. 40-45, (2000)",2
"bourdieu p., rites as acts of institution, honor and grace in anthropology., pp. 79-89, (1992)",2
"bourdieu p., the economics of linguistic exchanges, information (international social science council), 16, pp. 645-668, (1977)",2
"bourdieu p., but who created the creators?, the sociology of art: a reader, (2003)",2
"bourdieu p., the sentiment of honour in kabyle society, honour and shame, pp. 191-242, (1965)",2
"bourdieu p., picturing algeria, (2012)",2
"bourdieu p., intellectual field and creative project, ssi, 8, 2, pp. 89-119, (1969)",2
"bourdieu p., price formation and the anticipation of profits, language and symbolic power, pp. 66-89, (1991)",2
"bourdieu p., the logic of practice, pp. 69-70, (1990)",2
"bourdieu p., distinction: a critique of the judgment of taste",2
"bourdieu p., et al., effects of place, the weight of the world, pp. 123-128, (1993)",2
"bourdieu p., les jeux olympiques. programme pour une analyse, actes de la recherche en sciences sociales, 103, pp. 102-103, (1994)",2
"bourdieu p., passeron j.c., reproduction in education, soc. cult., 4, (1990)",2
"bourdieu p., masculine domination, trans. r. nice, (2001)",2
"bourdieu p., esquisses algériennes, (2008)",2
"bourdieu p., ein alltägliches spiel. geschlechterkonstruktion in der sozialen praxis, pp. 153-217, (1997)",2
"bourdieu p., disposition ésthétique et compétence artistique, les temps modernes, 295, pp. 1345-1378, (1971)",2
"bourdieu p., sociologie générale vol. i (1981-3), (2015)",2
"bourdieu p., ökonomisches kapital, kulturelles kapital, soziales kapital, soziale ungleichheiten (sozialen welt, sonderheft 2), pp. 183-198, (1983)",2
"bourdieu p., the algerian subproletariat, man, state and society in the contemporary maghreb, pp. 83-92, (1973)",2
"bourdieu p., the production and reproduction of legitimate language, language and symbolic power, (1991)",2
"bourdieu p., distinction: a social critique of the judgment of taste. translated by r. nice, 1984, (1979)",2
"bourdieu p., delegation and political fetishism, thesis eleven, 10, 1, pp. 56-70, (1985)",2
"bourdieu p., séminaires sur le concept de champ, 1972–1975, actes de la recherche en sciences sociales, 200, pp. 4-37, (2013)",2
"bourdieu p., interventions, 1961–2001: science sociale et action politique, (2002)",2
"bourdieu p., public opinion does not exist, sociology in question, pp. 149-157, (1995)",2
"bourdieu p., droit et passe-droit, actes de la recherche en sciences sociales, 2-81, pp. 86-96, (1990)",2
"bourdieu p., sur les rapports entre la sociologie et l'histoire en allemagne et en france, actes de la recherche en sciences sociales, 7-106, pp. 108-122, (1995)",2
"bourdieu p., si le monde social m'est supportable, c'est parce que je peux m'endigner, (2002)",2
"bourdieu p., collier p., homo academicus, (1988)",2
"bourdieu p., et al., structures, habitus, practice, contemporary sociological theory, pp. 345-358, (2012)",2
"bourdieu p., passeron j., reproduction in economy and society, (1970)",2
"bourdieu p., boltanski l., saint martin m., les stratégies de reconversion les classes sociales et le système d'enseignement, social science information, 12, pp. 61-113, (1973)",2
"bourdieu p., schultheis f., pfeuffer a., with weber against weber: in conversation with pierre bourdieu, the legacy of pierre bourdieu: critical essays, pp. 111-124, (2011)",2
"bourdieu p., masculine domination(richard nice, trans.), (2001)",2
"bourdieu p., de saint martin m., agrégation et ségrégation, le champ des grandes écoles et le champ du pouvoir, actes de la recherche en sciences sociales, 69, pp. 2-50, (1987)",2
"bourdieu p., comprendre, la misère du monde, pp. 1389-1447, (1993)",2
"bourdieu pierre, esquisse d'une théorie de la pratique, (1972)",2
"bourdieu p., passeron j.-c., cultural reproduction and social reproduction, knowledge, education, and cultural change, pp. 71-112, (1973)",2
"bourdieu p., passeron j.-c., die illusion der chancengleichheit: untersuchungen zur soziologie des bildungswesens am beispiel frankreichs, (1971)",2
"bourdieu p., equisse d’une théorie de la pratique, (1977)",2
"bourdieu p., acts of resistance against the tyranny of the market, translated by r. nice, (1999)",2
"bourdieu p., the rules of art: structure and genesis of the literary field, (1996)",2
"bourdieu p., delsaut y., pour une sociologie de la perception, actes de la recherche en sciences sociales, 40, pp. 3-9, (1981)",2
"bourdieu p., symbolsk makt: artikler i utvalg, (1996)",2
"bourdieu p., l'institutionnalisation de l'anomie, les cahiers du musée national d'art moderne, 19-20, pp. 6-19, (1987)",2
"bourdieu p., structures, habitus, power: basis for a theory of symbolic power, a reader in contemporary social theory, pp. 520-538, (1977)",2
"bourdieu p., les conditions sociales de la production sociologique: sociologie coloniale et décolonisation de la sociologie, le mal de voir, pp. 416-427, (1975)",2
"bourdieu p., entre amis, awal, 21, pp. 5-10, (2000)",2
"bourdieu p., time perspectives of the kabyle, the sociology of time, pp. 219-237, (1990)",2
"bourdieu p., praktiskt förnuft. bidrag till en handlingsteori, (1995)",2
"bourdieu p., cultural reproduction and social reproduction, inequality: classic readings in race, class, and gender, pp. 257-271, (2006)",2
"bourdieu p., readings in economic sociology, pp. 46-58, (2008)",2
"bourdieu p., meditationen: zur kritik der scholastischen vernunft, (2004)",2
"bourdieu p., algeria 1960: essays., (1979)",2
"bourdieu p., the future of class and the causality of the probable, re-thinking economics. exploring the work of pierre bourdieu, pp. 233-271, (2014)",2
"bourdieu p., rethinking the state: genesis and structure of the political field, sociological theory, 12, pp. 1-18, (1994)",2
"bourdieu p., language and symbolic power, pp. 163-170, (1991)",2
"bourdieu p., bourdieu p., the kabyle house or the world reversed, algeria 1960, (1972)",2
"bourdieu p., sport and social class, theory and methods, 17, 6, pp. 819-840, (1978)",2
"bourdieu p., a diagram of social position and life-style, media, culture and society, 2, pp. 255-259, (1980)",2
"bourdieu p., karabel j., halsey a.h., cultural reproduction and social reproduction, power and ideology in education, pp. 56-68, (1977)",2
"bourdieu p., homo academicus, (2003)",2
"bourdieu p., the force of law: toward a sociology of the juridical field’, hastings law j., 38, (1987)",2
"bourdieu p., the science of science and reflexivity, translated by richard nice, (2004)",2
"bourdieu p., the state nobility: elite schools in the field of power (l. c. clough trans.), (1996)",2
"bourdieu p., de la guerre révolutionnaire à la révolution, l'algérie de demain, (1962)",2
"bourdieu p., alain d., jean-pierre r., claude s., travail et travailleurs en algérie, (1963)",2
"bourdieu p., jean-claude c., jean-claude p., the craft of sociology: epistemological preliminaries, (1968)",2
"bourdieu p., the odyssey of reappropriation, ethnography, 5, 4, pp. 617-621, (1998)",2
"bourdieu p., esquisse pour une auto-analyse, outline for a self-analysis, (2004)",2
"bourdieu p., the state, economics and sport (translated by h dauncey and g hare), culture, sport, society, 1, 2, pp. 15-21, (1998)",2
"bourdieu p., à contre-pente (entretien avec philippe mangeot), vacarme, 14, pp. 4-14, (2000)",2
