top_reference,total_count
"bourdieu p., cultural reproduction and social reproduction, modernity: cultural modernity, 2, (1999)",2
"wacquant l., towards a reflexive sociology: a workshop with pierre bourdieu, 7, 1, pp. 26-63, (1989)",2
"bourdieu p., classification struggles, (2018)",2
"bourdieu p., the contradictions of inheritance, the weight of the world, pp. 507-513, (1999)",2
"bourdieu p., forms of capital, handbook for the theory of research for the sociology of education, (1986)",2
"bourdieu p., reproduction culturelle et reproduction sociale, information sur les sciences sociales, 10, 2, pp. 45-99, (1971)",2
"bourdieu p., bourdieu m.-c., le paysan et la photographie, revue française de sociologie, 6, pp. 164-174, (1965)",2
"bourdieu p., johnson r., the field of cultural production, (1993)",2
"bourdieu p., nouvelles reflexions sur la domination masculine, cahiers du genre, 33, pp. 225-233, (2002)",2
"bourdieu p., et al., the weight of the world, (2002)",2
"bourdieu p., passeron j.c., reproduction, society and culture, (1990)",2
"bourdieu p., wacquant l., una invitacion a la sociologia reflexiva, (2008)",2
"bourdieu p., the production of belief: contribution to an economy of symbolic goods, the field of cultural production: essays on art and literature, pp. 74-111, (1980)",2
"bourdieu p., les conditions sociales de la circulation internationale des ideés, cahiers d'histoire des littératures romanes, 14, 1-2, pp. 1-10, (1990)",2
"bourdieu p., gender and symbolic violence, violence in war and peace: an anthology, pp. 339-342, (2004)",2
"bourdieu p., interventionen 1961-2001, (2003)",2
"bourdieu p., af praktiske grunde. om teorien om menneskelig handling, (1997)",2
"bourdieu p., beister h., praktische vernunft: zur theorie des handelns, (1998)",2
"bourdieu p., passeron j.c., chamboredon j.c., the craft of sociology: epistemological preliminaries, (1991)",2
"bourdieu p., poder, derecho y clases sociales, (2000)",2
"bourdieu p.j.-c., chamboredonpasseron j.-c., the craft of sociology: epistemological preliminaries. translated by richard nice, (1991)",2
"bourdieu p., practical reason: on the theory of action, pp. 19-34, (1994)",2
"bourdieu p., entwurf einer theorie der praxis, (1976)",2
"bourdieu p., science de la science et réflexivité. cours du collège de france 2000-2001, (2001)",2
"bourdieu p., the logic of practice. stanford, (1980)",2
"bourdieu p., the logic of practice cambridge: polity press, (1990)",2
"bourdieu p., stratégies de reproduction et modes de domination, actes de la recherche en sciences sociales, 105, 1, pp. 3-12, (1994)",2
"bourdieu p., but who created the “creators”, sociology in question, pp. 139-148, (1993)",2
"bourdieu p., selections from the logic of practice, the logic of the gift: toward an ethic of generosity, pp. 190-230, (1997)",2
"bourdieu p., la noblesse d'état: grands corps et grandes écoles [the state nobility: elite schools in the field of power], (1989)",2
"bourdieu p., social space and symbolic space, practical reason: on the theory of action, pp. 1-13, (1998)",2
"bourdieu p., universal corporatism: the role of intellectuals in the modern world, poetics today, 12, pp. 655-669, (1991)",2
"bourdieu p., the genesis of the concepts of habitus and field, sociocriticism, theories and perspectives, 2, 2, pp. 11-24, (1985)",2
"bourdieu p., ‘is a disinterested act possible?, practical reason, pp. 75-91, (1998)",2
"bourdieu p., dauncey h., hare g., the state, economics and sport, culture, sport, society, 1, 2, pp. 15-21, (1998)",2
"bourdieu p., distinction: a social critique of the judgement of taste, cambridge: cambridge university press., (1984)",2
"bourdieu p., bourdieu, et al., the space of points of view, the weight of the world: social suffering in contemporary society, pp. 3-5, (1999)",2
"bourdieu p., “program for a sociology of sport”, sociology of sport journal, 5, pp. 1):153-161, (1988)",2
"bourdieu p., de la maison du roi à la raison d'é tat: un modèle de la genèse du champ bureaucratique, actes de la recherche en sciences sociales, 118, pp. 55-68, (1997)",2
"bourdieu p., wacquant l., the purpose of reflexive sociology, pp. 61-215, (1992)",2
"bourdieu p., scientific method and the social hierarchy of objects, actes de la recherche en sciences sociales, 1, pp. 4-6, (1975)",2
"bourdieu p., masculine domination, translated by richard nice, (2001)",2
"bourdieu p., sur l’état. cours au collège de france, (2012)",2
"bourdieu p., la distinction: critique sociale du jugement, paris: éditions de minuit, (2012)",2
"bourdieu p., the forms of capital, the sociology of economic life, pp. 241-258, (2018)",2
"bourdieu p., photography: a middle-brow art, shaun whiteside, (1990)",2
"bourdieu p., accardo a., balazs g., beaud s., bonvin f., bourdieu e., bourgois p., broccolichi s., champagne p., christin r., the weight of the world: social suffering in comtemporary society, (1999)",2
"bourdieu p., panofsky e., postface, architecture gothique et pensée scholastique, (1967)",2
"bourdieu p., wacquant l., on the cunning of imperial reason, pierre bourdieu and democratic politics: the mystery of ministry, (2005)",2
"bourdieu p., passeron j.-c., les étudiants et leurs études, (1964)",2
"bourdieu p., a science that makes trouble, sociology in question., (1993)",2
"bourdieu p., esquisse d'une théorie de la pratique, outline of a theory of practice, (1972)",2
"bourdieu p., the struggle for symbolic order: an interview with pierre bourdieu, theory, culture and society, 3, 3, pp. 37-51, (1986)",2
"bourdieu p., loic w., the organic ethnologist of algerian migration, ethnography, 1-2, fall, pp. 173-182, (2000)",2
"bourdieu p., the mystery of the ministry: from particular wills to the general will, pierre bourdieu and democratic politics: the mystery of ministry, pp. 55-63, (2005)",2
"bourdieu p., rethinking the state: genesis and structure of the bureaucratic field, (1994)",2
"bourdieu p., on the state: lectures at the college de france, (2015)",2
"bourdieu p., social space and symbolic power, in other words, pp. 122-139, (1990)",2
"bourdieu p., 'the family spirit', appendix of ch. 3, 'rethinking the state', practical reasons, (1998)",2
"bourdieu p., von gebrauch der wissenschaft. fuer eine klinische soziologie des wissenschaftlichen feldes, (1998)",2
"bourdieu p., r. nice, trans., distinction: a social critique of the judgment of taste, (1984)",2
"bourdieu p., the field of cultural production, or: the economic world reversed, the field of cultural production, pp. 29-74, (1993)",2
"bourdieu p., knowledge, education, and cultural change: papers in the sociology of education, pp. 71-112, (1973)",2
"bourdieu p., la cause de la science, actes de la recherche en sciences sociales, 106-107, (1995)",2
"bourdieu p., christin o., will p.-e., sur la science de l'état, actes de la recherche en sciences sociales, 133, pp. 4-10, (2000)",2
"bourdieu p., intellectual field and creative project, information (international social science council), 8, 2, pp. 89-119, (1969)",2
"bourdieu p., nice r., outline of a theory of practice, 16, (1977)",2
"bourdieu p., the biographical illusion, biography in theory. key texts with commentaries, pp. 210-216, (2017)",2
"bourdieu p., de saint martin m., scholastic excellence and the values of the educational system, contemporary research in the sociology of education, pp. 338-371, (1974)",2
"bourdieu p., social theory for the changing society, (1991)",2
"bourdieu p., the role of intellectuals today, theoria, 49, pp. 1-6, (2002)",2
"bourdieu p., outline of a theory of practice. cambridge studies in social and cultural anthropology 16, (2010)",2
"bourdieu p., sur l’état, (2012)",2
"bourdieu p., unite and rule, firing back: against the tyranny of the market 2, pp. 82-96, (2003)",2
"bourdieu p., de regels van de kunst",2
"bourdieu p., les héritiers: les étudiants et la culture, (1964)",2
"bourdieu p., in other words",2
"bourdieu p., remarques provisoires sur la perception sociale du corps” [“provisional notes on the social perception of the body”], actes de la recherche en sciences sociales, 14, 14, pp. 51-54, (1977)",2
"bourdieu p., sapiro g., mchale b., fourth lecture. the role of intellectuals in the modern world, poetics today, 12, 4, pp. 655-669, (1991)",2
"bourdieu p., microcosmes. théorie des champs, (2022)",2
"bourdieu p., cultural reproduction and social reproduction, the structure of schooling: readings in the sociology of education, pp. 46-55, (2000)",2
"bourdieu p., delegation and political fetishism"" in language and symbolic power, pp. 203-219",2
"bourdieu, political representation",2
"bourdieu p., rethinking the state: genesis and structure of the bureaucratic field, state/ culture, pp. 53-75, (1999)",2
"bourdieu p., algeria 1960: the disenchantment of the world, (1979)",2
"bourdieu p., the rules of art: genesis and structure of the literary field (trans. s emanuel). stanford, ca: stanford university press, (1996)",2
"bourdieu p., pascalian meditations, polity press, (2000)",2
"bourdieu p., järjen käytännöllisyys, (1998)",2
"bourdieu p., tout est social!, magazine littéraire, 303, pp. 104-111, (1992)",2
"bourdieu p., christin r., la construction du marché, actes de la recherche en sciences sociales, 81-82, pp. 65-85, (1990)",2
"bourdieu p., accardo a., ferguson p., the weight of the world: social suffering in contemporary society, (1999)",2
"bourdieu p., manet and the institutionalization of anomie, the field of cultural production, pp. 238-253, (1993)",2
"bourdieu p., biggart n.w., the forms of capital, readings in economic sociology, pp. 46-58, (2008)",2
"bourdieu p., capital et marche linguistique, linguistische berichte, 90, pp. 3-24, (1984)",1
"bourdieu p., the berber house, rules and meanings: the anthropology of everyday knowledge, pp. 98-110, (1971)",1
"bourdieu p., systems of education and systems of thought, in: m.f.d. young, (1971)",1
"bourdieu p., passeron j.-c., (1979)",1
"bourdieu p., l’économic des échanges linguistiques, langue française, 34, pp. 17-34, (1977)",1
"bourdieu p., meanwhile i have come to know all the diseases of sociological understanding.’ an interview with pierre bordieu by beate krais, the craft of sociology, (1991)",1
"bourdieu p., les stratégies matrimoniales dans le système de reproduction, annales, economies, sociétés, civilisations, 27, pp. 1105-1125, (1972)",1
"bourdieu p., handbook of theory and research for the sociology of education (new york, greenwood press), (1986)",1
"bourdieu p., cultural anthropology, 5, pp. 380-391, (1990)",1
"bourdieu p., luc b., changes in social structure and changes in demand for education, contemporary europe: structural change and cultural patterns, pp. 197-227, (1978)",1
"bourdieu p., le sens pratique, paris: minuit, (1980)",1
"bourdieu p., boltanski l., the educational system and the economy: titles and jobs, french sociology, pp. 141-151, (1981)",1
"bourdieu p., et al., the school as a conservative force, schooling and capitalism, (1976)",1
"bourdieu p., et al., schooling and capitalism., (1976)",1
"bourdieu p., french sociology, (1981)",1
"bourdieu p., cultural reproduction and social reproduction, power and ideology in education, edited by jerome karabel and atl halsey. oxford university press, (1977)",1
"bourdieu p., structure. technical report tr2. center for the social sciences, columbia university, (1987)",1
"bourdieu p., –the market of symbolic goods.— translated by rupert swyer, poetics, 14, pp. 13-44, (1985)",1
"bourdieu p., the specificity of the scientific field and the social conditions of the progress of reason, french sociology: rupture and renewal since 1968, pp. 257-292, (1975)",1
"bourdieu p., distinction. translated by richard nice. harvard university press, burkhardt, (1984)",1
"bourdieu p., sosiologian kysymyksiä. (the questions of sociology), (1985)",1
"bourdieu p., passeron s.d., a reproduciio. elementos para uma teoria do sisterna de ensino",1
"bourdieu, pierre, (1984)",1
"bourdieu p., historische und soziale vorussetzungen des modernen sports, pp. 91-112, (1986)",1
"bourdieu p., the production of belief, media, culture and society, 2, 3, pp. 261-294, (1982)",1
"bourdieu p., la construction du marché: le champ administratif et la production de la politique du logement, actes de la recherche en sciences sociales. n, 81, (1990)",1
"bourdieu p., choses dites kouzou to jissen (japanese translation), (1987)",1
"bourdieu p., knowledge, education and cultural change. london: tavistock, (1974)",1
"bourdieu p., le métier de sociologue, (1968)",1
"bourdieu p., time perspectives of the kabyles, mediterranean countryman, 6, pp. 55-72, (1963)",1
"bourdieu p., la distinzione, (1983)",1
"bourdieu p., politics and nationhood: post-revolutionary portugal, (1984)",1
"bourdieu p., die biographische illusion, bios - zeitschrift für biographieforschung und oral history, 1, pp. 75-81, (1990)",1
"bourdieu p., collier p., homo academicus. trans. by, (1988)",1
"bourdieu p., passeron j.-g., structuralism and the theory of sociological knowledge, social research, 35, 4, (1968)",1
"bourdieu, pierre, condition de classe et position de class archives europeennes de sociologie, 7, 2, (1966)",1
"bourdieu, pierre, passeron, jean-claude, les temps modernes, 211, pp. 998-1021, (1963)",1
"bourdieu p., richard nice, outline of a theory of practice, (1977)",1
"bourdieu p., ‘fieldwork in philosophy’, choses dites, pp. 13-46, (1987)",1
"bourdieu p., ‘repères’, choses dites, note 9, (1927)",1
"bourdieu p., ‘repères’, note 12, pp. 47-71",1
"bourdieu p., ‘fieldwork in philosophy’, note 9",1
"bourdieu p., la délégation ou le fétichisme politique, note 9, pp. 185-202",1
"bourdieu p., ‘la délégation …’, note 9",1
"bourdieu p., ‘repères’, note 9",1
"bourdieu p., sports, classes sociales et sub-cultures, conference introduction in sports et societes contemporaines: vllle symposium de icss, (1983)",1
"bourdieu p., sozialer raum und “klassen.”, (1985)",1
"bourdieu p., berkley journal of sociology, what makes a sodai class? on the theoretical and practical existence of groups, (1987)",1
"bourdieu p., cambridge, ma: harvard university press, distinction: a social critique of the judgement of taste, (1984)",1
"bourdieu p., esprits d'état. genèse et structure du champ bureaucratique, raisons pratiques: sur la théorie de l'action., pp. 101-145, (1994)",1
"bourdieu, distinction., (1979)",1
"bourdieu p., méthode scientifique et hiérarchie sociale des objets, actes de la recherche en sciences sociales, 1, pp. 4-6, (1975)",1
"bourdieu p., homo academicus, homo academicus, (1984)",1
"bourdieu p., boltanski l., castel r., chamboredon j.-c., un art moyen, photography as a middlebrow art, (1965)",1
"bourdieu p., richardson j.g., the forms of capital, pp. 241-258, (1986)",1
"bourdieu p., structuralism and theory of sociological knowledge, social research",1
"bourdieu p., la noblesse d'etat: grandes écoles et esprit de corps",1
"bourdieu p., mattelart a., siegelaub s., public opinion does not exist’, pp, communication and class struggle., pp. 124-30 in, (1979)",1
"bourdieu p., discussion with terry eagleton, (1991)",1
"bourdieu, passeron, la reproduction., (1970)",1
"bourdieu p., collins r., curran j., garnham n., scannell p., schlesinger p., sparks c., the aristocracy of culture, media, culture and society: a critical reader, (1986)",1
"bourdieu p., knowledge and control, (1971)",1
"bourdieu p., distinction: a social critique of taste, translated by richard nice, 22, pp. 3-14, (1984)",1
"bourdieu, in other words, pp. 133-134",1
"bourdieu p., the sense of honor, algeria 1960, (1979)",1
"bourdieu p., die soziologie symbolischer formen, (1976)",1
"bourdieu p., homo academicus paris: minuit 1984 and esquisse pour une auto-analyse paris: raisons d agir, (2004)",1
"the reality of reduction: the failed synthesis of pierre bourdieu, fin de siècle social theory, (1995)",1
"bourdieu p., photography: a middle brow art, trans, (1990)",1
"bourdieu p., sociology is a martial art: political writings, (2010)",1
"bourdieu p., boltanski l., changes in social structure and changes in the demand for education, sociology of education: major themes, volume 2, inequalities and oppressions, 2, (2000)",1
"bourdieu p., préface, l'immigration, ou les paradoxes de l'alterité, pp. 7-9, (1991)",1
"bourdieu p., la distinction (distinction), (1979)",1
"bourdieu p., eagleton t., mapping ideology, pp. 265-277, (2000)",1
"bourdieu p., la métamorfoses de goût, questions de sociologie, pp. 161-172, (1980)",1
"bourdieu p., the logic of practice, richard nice (trans.), (1990)",1
"bourdieu p., sociology of education: a critical reader, pp. 83-96, (2007)",1
"bourdieu p., la précarité est aujourd’hui partout: intervention lors des rencontres européennes contre la précarité, grenoble, (1997)",1
"bourdieu p., the essence of neoliberalism, (1998)",1
"bourdieu p., the forms of capital, john g. richardson, pp. 241-258, (1986)",1
"bourdieu p., forms of capital. general sociology, volume 3. lectures at the collège de france (1983–1984), (2021)",1
"bourdieu p., the antinomies of collective voice, development, democracy, and the art of trespassing: essays in honor of albert o. hirschman, (1986)",1
"bourdieu p., sociology in question. theory, culture & society, (1993)",1
"bourdieu p., passeron j.c., eléments pour une théorie du système d’enseignement, (1970)",1
"bourdieu p., os usos sociais da ciência: por uma sociologia clínica do campo científico, (2004)",1
"bourdieu p., the odyssey of reappropriation, ethnography, 5, (2004)",1
"bourdieu p., on understanding' the weight of the world",1
"bourdieu p., alain a., gabrielle b., the weight of the world, stanford: stanford university press, (2000)",1
"bourdieu p., the historical genesis of the pure aesthetic, the field of cultural production, (1968)",1
"bourdieu p., commentary on the commentaries, contemporary sociology, 21, 2, pp. 151-161, (1992)",1
"bourdieu p., la dissolution du religieux, choses dites, pp. 117-123, (1987)",1
"bourdieu p., passeron j.-c., de saint martin m., students and the language of teaching, academic discourse: linguistic misunderstanding and professorial power, pp. 35-79, (1994)",1
"bourdieu p., political interventions: social science and political action, texts selected and introduced by franck poupeau and thierry discepolo, (2008)",1
"bourdieu p., the forms of capital. handbook of theory and research for the sociology of education. jg richardson, new york, greenwood, 241, 258, (1986)",1
"bourdieu p., the social conditions of the international circulation of ideas, actes de la recherche en sciences sociales, 145, 5, pp. 3-8, (2002)",1
"bourdieu p., homo academicus. english translation, (1988)",1
"bourdieu p., the field of cultural production (various translations), (1993)",1
"bourdieu p., die feinen unterschiede. kritik der gesellschaftlichen urteilskraft [distinction: a social critique of the judgement of taste], (1982)",1
"bourdieu p., sozialer sinn. kritik der theoretischen vernunft [the logic of practice], (1993)",1
"bourdieu p., the logic of practice. r. nice translated, (1990)",1
"bourdieu p., practical reason. r. nice translated, (1998)",1
"bourdieu p., program for the sociology of sport, the olympics and cultural exchange., (1988)",1
"bourdieu p., medytacje pascaliańskie, (2006)",1
"bourdieu p., la distinction: critique du jugement social., (1979)",1
"bourdieu p., champagne p., outcasts on the inside, the weight of the world, (1999)",1
"bourdieu p., language and symbolic power cambridge, (1991)",1
"bourdieu p., la lógica de los campos, una invitación a la sociología reflexiva, pp. 147-173, (2005)",1
"bourdieu p., et al., the weight of the world, trans. p. ferguson et al, (1999)",1
"bourdieu p., les conditions sociales de la circulation internationale des idées” [the social conditions of the international circulation of ideas], actes de la recherche en sciences sociales, 145, pp. 3-8, (2002)",1
"bourdieu p., champagne p., outcasts on the inside, the weight of the world: social suffering in contemporary society, pp. 421-426, (1999)",1
"bourdieu p., coisas ditas, (1990)",1
"bourdieu p., on the theory of action, (1998)",1
"bourdieu p., der einzige und sein eigenheim, (2002)",1
"bourdieu p., la distinction. critique sociale du jugement [distinction], (1979)",1
"bourdieu p., anthropologie economique, (2017)",1
"bourdieu p., boltanski l., photography: a middle-brow art, (1990)",1
"bourdieu p., on symbols and society, (1986)",1
"bourdieu p., family and society, pp. 117-144, (1976)",1
"bourdieu p., the sociology of economic life, pp. 96-111, (2001)",1
"bourdieu p., nice r., wacquant l., the peasant and his body, ethnography, 5, 4, pp. 579-599, (2004)",1
"bourdieu p., the rules of art: genesis and structure of the literary field (meridian: crossing aesthetics), (1996)",1
"bourdieu p., passeron j., nice r., bottomore t., reproduction in education, society, and culture, (2014)",1
"bourdieu p., le paradoxe du sociologue, sociologie et sociétés, 11, 1, pp. 85-94, (1979)",1
"bourdieu p., comment peut-on être sportif?, questions de sociologie, pp. 173-195, (2002)",1
"bourdieu p., flaubert's point of view, literature and social practice, pp. 211-234, (1989)",1
"bourdieu p., pascalian meditations (nice r., trans.). stanford university press, (original work published, (2000)",1
"bourdieu p., the social structures of the economy (turner c., trans.), polity press, (2005)",1
"bourdieu p., an outline of a theory of practice cambridge, (1977)",1
"bourdieu p., the attitude of the algerian peasant towards time, the sociology of time, pp. 219-237, (1990)",1
"bourdieu p., reproducción cultural y reproducción social. [cultural and social reproduction], (1970)",1
"bourdieu p., la autoridad pedagógica, sociología y política social de la educación, pp. 221-236, (2005)",1
"bourdieu p., why the social sciences must take themselves as their object, science of science and reflexivity, pp. 85-114, (2004)",1
"bourdieu p., outline of a theory of practice. translated by r. nice, 1977, (1972)",1
"bourdieu p., translated by c. newman. the historical genesis of a pure aesthetic, the journal of aesthetics and art criticism, 46, pp. 201-210, (1987)",1
"bourdieu p., pascalian meditations. cambridge, uk: polity press, 1997 translated by richard nice, (2000)",1
"bourdieu p., die feinen unterschiede (or, la distinction), (1982)",1
"bourdieu p., il dominio maschile, (1999)",1
"bourdieu p., [1986]) the forms of capital. in: szeman i and kaposy t (eds) cultural theory: an anthology, pp. 81-93, (2011)",1
"bourdieu p., the forms of capital, marxist internet archive, (1986)",1
"bourdieu p., sobre el estado. cursos en el collège de france (1989-1992), (2014)",1
"bourdieu p., lectures pierre, on the state: lectures at the college de france 1989–1992, (2014)",1
"bourdieu p., comment la culture vient aux paysans, paysans, 62, pp. 6-20, (1966)",1
"bourdieu p., social space and the genesis of ""classes'"" (1984) in bourdieu, language and symbolic power, pp. 229-291, (1991)",1
"bourdieu p., kapitalismus als konservative restauration, die zeit, (1988)",1
"bourdieu p., description and prescription: the conditions of possibility and the limits of political effectiveness, language and symbolic power, pp. 127-136, (1991)",1
"bourdieu p., against the policy of depoliticization, studies in political economy, 69, 1, pp. 31-41, (2002)",1
"bourdieu p., la grève et l’action politique, questions de sociologie, pp. 251-263, (1984)",1
"bourdieu p., quelques propriétés des champs, questions de sociologie, pp. 113-120, (1984)",1
"bourdieu p., social conditions for the international circulation of ideas, romanistische zeitschrift fur literaturgeschichte-cahiers d histoire des litteratures romanes, 14, 1-2, pp. 1-10, (1990)",1
"bourdieu p., marcel mauss aujourd'hui, sociologie et sociétés, 36, pp. 15-22, (2004)",1
"bourdieu p., sketch for a self-analysis, science of science and reflexivity., pp. 94-114, (2004)",1
"bourdieu p., structures and the habitus, material culture: critical concepts in the social sciences, pp. 72-95, (2004)",1
"bourdieu p., readings in the theory of educational system, pp. 159-183, (1971)",1
"bourdieu p., bourdieu and the journalistic field, pp. 29-47, (2005)",1
"bourdieu p., principles for a sociology of cultural works, the field of cultural production: essays on art and literature, pp. 176-191, (1993)",1
"bourdieu p., neoliberalism, utopia of unlimited exploitation, political interventions: social science and political action, pp. 94-105, (2008)",1
"bourdieu p., social scientists, economic science and the social movement, political interventions: social science and political action, pp. 52-59, (2008)",1
"bourdieu p., la logique interne de la civilisation algérienne traditionnelle, le sous-développement en algérie, pp. 40-51, (1959)",1
"bourdieu p., le desenchantement du monde: travail et travailleurs en algérie, (1966)",1
"bourdieu p., le plaisir de savoir, pp. 1-10, (1984)",1
"bourdieu p., mit weber gegen weber. pierre bourdieu im gespräch, pierre bourdieu. das religiöse feld, pp. 111-129, (2000)",1
"bourdieu p., sayad a., le déracinement, (1964)",1
"bourdieu p., le partage des bénéfices. expansion et iné galités en france, pp. 383-421, (1966)",1
"bourdieu p., knowledge, education, and social change, pp. 71-112, (1971)",1
"bourdieu p., boltanski l., de saint-martin m., contemporary europe. social structures and cultural patterns, pp. 197-288, (1973)",1
"bourdieu p., schultheis f., pfeuffer a., the legacy of pierre bourdieu: critical essays, pp. 111-125, (2000)",1
"bourdieu p., razões práticas: sobre a teoria da ação (practical reasons: about the theory of action), (1996)",1
"bourdieu p., wacquant l., uma invitación a la sociologia reflexiva (an invitation to reflexive sociology), (2005)",1
"bourdieu p., the bachelor's ball, translated by richard nice, (2008)",1
