top_reference,total_count
"bourdieu p., distinction: a social critique of the judgement of taste, (1984)",2319
"bourdieu p., outline of a theory of practice, (1977)",1197
"bourdieu p., the forms of capital, handbook of theory and research for the sociology of education, pp. 241-258, (1986)",1042
"bourdieu p., the logic of practice, (1990)",998
"bourdieu p., wacquant l., an invitation to reflexive sociology, (1992)",847
"bourdieu p., passeron j.-c., reproduction in education, society and culture, (1977)",715
"bourdieu p., language and symbolic power, (1991)",489
"bourdieu p., distinction, (1984)",426
"bourdieu p., pascalian meditations, (2000)",396
"bourdieu p., homo academicus, (1988)",285
"bourdieu p., the field of cultural production, (1993)",214
"bourdieu p., masculine domination, (2001)",206
"bourdieu p., the state nobility: elite schools in the field of power, (1996)",196
"bourdieu p., in other words: essays towards a reflexive sociology, (1990)",189
"bourdieu p., practical reason: on the theory of action, (1998)",184
"bourdieu p., social space and symbolic power, sociological theory, 7, 1, pp. 14-25, (1989)",178
"bourdieu p., sociology in question, (1993)",174
"bourdieu p., the rules of art: genesis and structure of the literary field, (1996)",164
"bourdieu p., cultural reproduction and social reproduction, power and ideology in education, pp. 487-511, (1977)",162
"bourdieu p., the field of cultural production: essays on art and literature, (1993)",155
"bourdieu p., the social space and the genesis of groups, theory and society, 14, 6, pp. 723-744, (1985)",145
"bourdieu p., the social structures of the economy, (2005)",129
"bourdieu p., the weight of the world: social suffering in contemporary society, (1999)",122
"bourdieu p., practical reason, (1998)",104
"bourdieu p., what makes a social class? on the theoretical and practical existence of groups, berkeley journal of sociology, 32, pp. 1-17, (1987)",103
"bourdieu p., la distinction. critique sociale du jugement, (1979)",102
"bourdieu p., the state nobility, (1996)",102
"bourdieu p., sport and social class, social science information, 17, 6, pp. 819-840, (1978)",100
"bourdieu p., science of science and reflexivity, (2004)",92
"bourdieu p., the forms of capital, education: culture, economy, and society, pp. 46-58, (1997)",80
"bourdieu p., passeron j.-c., the inheritors: french students and their relation to culture, (1979)",79
"bourdieu p., the rules of art, (1996)",69
"bourdieu p., cultural reproduction and social reproduction, knowledge, education and cultural change, pp. 71-112, (1973)",67
"bourdieu p., rethinking the state: genesis and structure of the bureaucratic field, sociological theory, 12, 1, pp. 1-18, (1994)",61
"bourdieu p., acts of resistance: against the tyranny of the market, (1998)",58
"bourdieu p., le sens pratique, (1980)",54
"bourdieu p., the force of law: toward a sociology of the juridical field, hastings law journal, 38, pp. 814-853, (1987)",53
"bourdieu p., the field of cultural production, or: the economic world reversed, poetics, 12, 4-5, pp. 311-356, (1983)",52
"bourdieu p., the specificity of the scientific field and the social conditions of the progress of reason, social science information, 14, 6, pp. 19-47, (1975)",52
"bourdieu p., in other words, (1990)",51
"wacquant l., towards a reflexive sociology: a workshop with pierre bourdieu, sociological theory, 7, 1, pp. 26-63, (1989)",49
"bourdieu p., wacquant l., on the cunning of imperialist reason, theory, culture & society, 16, 1, pp. 41-58, (1999)",48
"bourdieu p., méditations pascaliennes, (1997)",46
"bourdieu p., sketch for a self-analysis, (2007)",45
"bourdieu p., habitus, habitus: a sense of place, pp. 27-34, (2002)",41
"bourdieu p., ‘the forms of capital’, handbook of theory and research for the sociology of education, (1986)",40
"bourdieu p., genesis and structure of the religious field, comparative social research, 13, pp. 1-44, (1991)",39
"bourdieu p., chamboredon j.-c., passeron j.-c., the craft of sociology: epistemological preliminaries, (1991)",38
"bourdieu p., on the state: lectures at the collège de france, 1989–1992, (2014)",38
"bourdieu p., acts of resistance: against the new myths of our time, (1998)",38
"bourdieu p., la noblesse d'état. grandes écoles et esprit de corps, (1989)",33
"bourdieu p., passeron j.-c., la reproduction. éléments pour une théorie du système d’enseignement, (1970)",33
"bourdieu p., on the family as a realized category, theory, culture and society, 13, 3, pp. 19-26, (1996)",33
"bourdieu p., raisons pratiques. sur la théorie de l'action, (1994)",33
"bourdieu p., on television, (1998)",33
"bourdieu p., la distinction, (1979)",32
"bourdieu p., the political field, the social science field, and the journalistic field, bourdieu and the journalistic field, pp. 29-47, (2005)",32
"bourdieu p., firing back: against the tyranny of the market 2, (2003)",31
"bourdieu p., the weight of the world, (1999)",31
"bourdieu p., passeron j.-c., la reproduction, (1970)",30
"bourdieu p., le capital social: notes provisoires, actes de la recherche en sciences sociales, 31, pp. 2-3, (1980)",30
"bourdieu p., questions de sociologie, (1980)",30
"bourdieu p., the economics of linguistic exchanges, social science information, 16, pp. 645-668, (1977)",29
"bourdieu p., the school as a conservative force: scholastic and cultural inequalities, contemporary research in the sociology of education, pp. 32-46, (1974)",29
"bourdieu p., the algerians, (1962)",28
"bourdieu p., on television and journalism, (1998)",28
"bourdieu p., darbel a., the love of art: european art museums and their public, (1991)",27
"bourdieu p., reproduction in education, society, and culture, (1977)",27
"bourdieu p., the political ontology of martin heidegger, (1991)",27
"bourdieu p., distinction: a social critique of the judgement of taste, translated by richard nice, (1984)",26
"bourdieu p., symbolic power, critique of anthropology, 4, 13-14, pp. 77-85, (1979)",25
"bourdieu p., cultural reproduction and social reproduction, knowledge, education, and cultural change: papers in the sociology of education, pp. 71-112, (1973)",25
"bourdieu p., (1984)",24
"bourdieu p., the genesis of the concepts of habitus and field, sociocriticism, 2, 2, pp. 11-24, (1985)",24
"bourdieu p., program for a sociology of sport, sociology of sport journal, 5, pp. 153-161, (1988)",24
"bourdieu p., sociologie de l'algérie, (1958)",24
"bourdieu p., algeria 1960, (1979)",23
"bourdieu p., making the economic habitus: algerian workers revisited, ethnography, 1, 1, pp. 17-41, (2000)",23
"bourdieu p., an invitation to reflexive sociology, (1992)",23
"bourdieu p., la domination masculine, (1998)",23
"bourdieu p., the forms of capital, the sociology of economic life, pp. 96-111, (2001)",22
"bourdieu p., the forms of capital, readings in economic sociology, pp. 280-291, (2002)",22
"bourdieu p., the forms of capital, cultural theory: an anthology, pp. 81-93, (1986)",22
"bourdieu p., choses dites, (1987)",21
"bourdieu p., the production of belief: contribution to an economy of symbolic goods, media, culture & society, 2, 3, pp. 261-293, (1980)",21
"bourdieu p., sayad a., le déracinement: la crise de l'agriculture traditionnelle en algérie, (1964)",21
"bourdieu p., passeron j.-c., reproduction in education, culture and society, (1977)",21
"bourdieu p., la misère du monde, (1993)",20
"bourdieu p., (1990)",20
"bourdieu p., the market of symbolic goods, poetics, 14, 1-2, pp. 13-44, (1985)",20
"bourdieu p., legitimation and structured interests in weber’s sociology of religion, max weber, rationality and modernity, pp. 119-136, (1987)",20
"bourdieu p., wacquant l., newliberalspeak: notes on the new planetary vulgate, radical philosophy, 105, pp. 2-5, (2001)",19
"bourdieu p., distinction: a social critique of the judgement of taste (r. nice, trans.), (1984)",19
"bourdieu p., participant objectivation, journal of the royal anthropological institute, 9, pp. 281-294, (2003)",19
"bourdieu p., acts of resistance, (1998)",19
"bourdieu p., chamboredon j.-c., passeron j.-c., the craft of sociology, (1991)",19
"bourdieu p., vive la crise! for heterodoxy in social science, theory and society, 17, 5, pp. 773-787, (1988)",18
"bourdieu p., the peculiar history of scientific reason, sociological forum, 6, 1, pp. 3-26, (1991)",18
"bourdieu p., thompson j.b., language and symbolic power, (1991)",18
"bourdieu p., esquisse d’une théorie de la pratique, précédé de trois études d’ethnologie kabyle, (1972)",18
"bourdieu p., ce que parler veut dire. l'économie des échanges linguistiques, (1982)",17
"bourdieu p., photography: a middle-brow art, (1990)",17
"bourdieu p., on the state, (2014)",17
"bourdieu p., rethinking the state: genesis and structure of the bureaucratic field, state/culture: state-formation after the cultural turn, pp. 53-75, (1999)",17
"bourdieu p., les règles de l'art. genèse et structure du champ littéraire, (1992)",17
"bourdieu p., passeron j.-c., the inheritors, (1979)",16
"bourdieu p., program for a sociology of sport, sociology of sport journal, 5, 2, pp. 153-161, (1988)",16
"bourdieu p., concluding remarks: for a sociogenetic understanding of intellectual works, bourdieu: critical perspectives, (1993)",15
"bourdieu p., handbook of theory and research for the sociology of education, (1986)",15
"bourdieu p., esquisse d'une théorie de la pratique, (1972)",15
"bourdieu p., sport and social class, rethinking popular culture: contemporary perspectives in cultural studies, pp. 357-373, (1991)",15
"bourdieu p., the social conditions of the international circulation of ideas, bourdieu: a critical reader, pp. 220-228, (1999)",15
"bourdieu p., some properties of fields, sociology in question, pp. 72-77, (1993)",15
"bourdieu p., les structures sociales de l'économie, (2000)",15
"bourdieu p., passeron j.-c., les héritiers. les étudiants et la culture, (1964)",14
"bourdieu p., célibat et condition paysanne, etudes rurales, 5, 6, pp. 32-136, (1962)",14
"bourdieu p., understanding, theory, culture & society, 13, 2, pp. 17-37, (1996)",14
"bourdieu p., the biographical illusion, identity: a reader, pp. 297-303, (2000)",14
"bourdieu p., science de la science et réflexivité, (2001)",14
"bourdieu p., les conditions sociales de la circulation internationale des idées, actes de la recherche en sciences sociales, 145, pp. 3-8, (2002)",14
"bourdieu p., chamboredon j.-c., passeron j.-c., le métier de sociologue, (1968)",14
"bourdieu p., le capital social, actes de la recherche en sciences sociales, 31, pp. 2-3, (1980)",14
"bourdieu p., wacquant l.j.d., farage s., rethinking the state: genesis and structure of the bureaucratic field, sociological theory, 12, 1, pp. 1-18, (1994)",14
"bourdieu p., intellectual field and creative project, social science information, 8, 2, pp. 89-119, (1969)",13
"bourdieu p., pascalian meditations., (2000)",13
"bourdieu p., les trois états du capital culturel, actes de la recherche en sciences sociales, 30, pp. 3-6, (1979)",13
"bourdieu p., eagleton t., doxa and common life, new left review, 191, pp. 111-121, (1992)",13
"bourdieu p., the bachelor's ball, (2008)",12
"bourdieu p., the bachelors' ball: the crisis of peasant society in béarn, (2008)",12
"bourdieu p., principles of an economic anthropology, the handbook of economic sociology, pp. 75-89, (2005)",12
"bourdieu p., algeria 1960: the disenchantment of the world, the sense of honour, the kabyle house or the world reversed, (1979)",12
"bourdieu p., loic w., an invitation to reflexive sociology, (1992)",11
"bourdieu p., la domination masculine, actes de la recherche en sciences sociales, 84, pp. 2-31, (1990)",11
"bourdieu p., outline of a theory of practice, translated by richard nice, (1977)",11
"bourdieu p., the attitude of the algerian peasant toward time, mediterranean countrymen, pp. 55-72, (1963)",11
"bourdieu p., sport and social class social sciences information, information sur les sciences sociales, 17, 6, pp. 819-840, (1978)",11
"bourdieu p., outline of a theory of practice (translated by richard nice), (1977)",11
"bourdieu p., political representation: elements for a theory of the political field, language and symbolic power, pp. 171-202, (1991)",11
"bourdieu p., sur l'état: cours au collège de france, 1989-1992, (2012)",11
"bourdieu p., the berber house or the world reversed, social science information, 9, 2, pp. 151-170, (1970)",11
"bourdieu p., the school as a conservative force: scholastic and cultural inequalities, schooling and capitalism: a sociological reader, (1976)",11
"bourdieu p., men and machines, advances in social theory and methodology: toward an integration of micro- and macro-sociologies, pp. 304-317, (1981)",10
"bourdieu p., avenir de classe et causalité du probable, revue française de sociologie, 15, 1, pp. 3-42, (1974)",10
"bourdieu p., champ intellectuel et projet créateur, les temps modernes, 246, pp. 865-906, (1966)",10
"bourdieu p., passeron j.-c., sociology and philosophy in france since 1945: death and resurrection of a philosophy without subject, social research, 34, 1, pp. 162-212, (1967)",10
"bourdieu p., wacquant l.j.d., réponses. pour une anthropologie reflexive, (1992)",10
"bourdieu p., genèse et structure du champ religieux, revue française de sociologie, 12, 3, pp. 295-334, (1971)",10
"bourdieu p., the contradictions of inheritance, weight of the world: social suffering in contemporary society, pp. 507-513, (1999)",10
"bourdieu p., l’illusion biographique, actes de la recherche en sciences sociales, 62-63, pp. 69-72, (1986)",10
"bourdieu p., esquisse pour une auto-analyse, (2004)",10
"bourdieu p., darbel a., rivet j.-p., seibel c., travail et travailleurs en algérie, (1963)",10
"bourdieu p., sur la télévision, (1996)",10
"bourdieu p., propos sur le champ politique, (2000)",10
"bourdieu p., a conservative revolution in publishing, translation studies, 1, 2, pp. 123-153, (2008)",10
"bourdieu p., intellectual field and creative project, knowledge and control: new directions for the sociology of education, pp. 161-188, (1971)",10
"bourdieu p., boltanski l., la production de l’idéologie dominante, actes de la recherche en sciences sociales, 2, 2-3, pp. 3-73, (1976)",10
"bourdieu p., la distinción: criterio y bases sociales del gusto, (1979)",10
"bourdieu p., algerian landing, ethnography, 5, 4, pp. 415-443, (2004)",10
"bourdieu p., ce que parler veut dire, (1982)",9
"bourdieu p., cultural reproduction and social reproduction, (1973)",9
"bourdieu p., marriage strategies as strategies of social reproduction, family and society, pp. 117-144, (1976)",9
"bourdieu p., the logic of practice (r. nice, trans.), (1990)",9
"bourdieu p., political interventions: social science and political action, (2008)",9
"bourdieu p., the peasant and his body, ethnography, 5, 4, pp. 579-599, (2004)",9
"bourdieu p., delsaut y., le couturier et sa griffe: contribution à une théorie de la magie, actes de la recherche en sciences sociales, 1, 1, pp. 7-36, (1975)",9
"bourdieu p., the forms of capital, (1986)",9
"bourdieu p., travail et travailleurs en algérie, (1963)",9
"bourdieu p., understanding, the weight of the world: social suffering in contemporary society, pp. 607-626, (1999)",9
"bourdieu p., haacke h., free exchange, (1995)",9
"bourdieu p., social space and symbolic power, in other words: essays towards a reflexive sociology, pp. 123-139, (1990)",9
"bourdieu p., handbook of theory of research for the sociology of education, pp. 241-258, (1986)",9
"bourdieu, boltanski, changes in social structure and changes in the demand for education, contemporary europe: social structure and cultural patterns, pp. 197-227, (1978)",8
"bourdieu p., the three forms of theoretical knowledge, social science information, 12, 1, pp. 53-80, (1973)",8
"bourdieu p., the sentiment of honour in kabyle society, honour and shame: the values of mediterranean society, pp. 191-241, (1965)",8
"bourdieu p., the forms of capital, pp. 241-258, (1986)",8
"bourdieu p., jean-claude p., reproduction in education, society and culture, (1977)",8
"bourdieu, l'école conservatrice: les inégalités devant l'école et devant la culture, revue française de sociologie, 7, pp. 225-226, (1966)",8
"bourdieu p., power and ideology in education, pp. 487-511, (1977)",8
"bourdieu p., public opinion does not exist, communication and class struggle, 1, pp. 124-130, (1979)",8
"bourdieu p., darbel a., the love of art, (1991)",8
"bourdieu p., symbolic capital and social classes, journal of classical sociology, 13, 2, pp. 292-302, (2013)",8
"bourdieu p., le bal des célibataires: crise de la société paysanne en béarn, (2002)",8
"bourdieu p., what makes a social class?, berkeley journal of sociology, 32, pp. 1-17, (1987)",8
"bourdieu p., de saint martin m., le patronat, actes de la recherche en sciences sociales, 20, pp. 3-82, (1978)",8
"bourdieu p., contre-feux, (1998)",8
"bourdieu p., accardo a., balazs g., beaud s., bonvin f., bourdieu e., bourgois p., et al., the weight of the world: social suffering in contemporary society, (1999)",8
"bourdieu p., passeron j.-c., reproduction in education, (1977)",7
"bourdieu p., the aristocracy of culture, media, culture and society, 2, pp. 225-254, (1980)",7
"bourdieu p., die feinen unterschiede. kritik der gesellschaftlichen urteilskraft, (1982)",7
"bourdieu p., un art moyen: essai sur les usages sociaux de la photographie, (1965)",7
"bourdieu p., education: culture, economy, and society, pp. 46-58, (1997)",7
"bourdieu p., scattered remarks, european journal of social theory, 2, 3, pp. 334-340, (1999)",7
"bourdieu p., identity and representation: elements for a critical reflection on the idea of region, language and symbolic power, pp. 220-228, (1991)",7
"bourdieu p., manet: une révolution symbolique, (2013)",7
"bourdieu p., le champ scientifique, actes de la recherche en sciences sociales, 2, 2, pp. 88-104, (1976)",7
"bourdieu p., boltanski l., the educational system and the economy: titles and jobs, french sociology: rupture and renewal since 1968, pp. 141-151, (1981)",7
"bourdieu p., langage et pouvoir symbolique, (2001)",7
"bourdieu p., manet: a symbolic revolution, (2017)",7
"bourdieu p., outline of a theory of practice. (r. nice, trans.), (1977)",7
"bourdieu p., chartier r., the sociologist and the historian, (2015)",7
"bourdieu p., erving goffman: discoverer of the infinitely small, theory, culture and society, 2, 1, pp. 112-113, (1983)",7
"bourdieu p., wacquant l., the purpose of reflexive sociology (the chicago workshop), an invitation to reflexive sociology, (1992)",7
"bourdieu p., structuralism and theory of sociological knowledge, social research, 35, pp. 681-706, (1968)",7
"bourdieu p., algerian sketches, (2013)",7
"bourdieu p., first lecture. social space and symbolic space: introduction to a japanese reading of distinction, poetics today, 12, 4, pp. 627-638, (1991)",7
"bourdieu p., physical space, social space and habitus, (1996)",7
"bourdieu p., the peasant and photography, ethnography, 5, 4, pp. 601-616, (2004)",7
"bourdieu p., site effects, the weight of the world: social suffering in contemporary society, pp. 123-129, (1999)",7
"bourdieu p., thinking about limits, theory, culture and society, 9, 1, pp. 37-49, (1992)",7
"bourdieu p., le champ économique, actes de la recherche en sciences sociales, 119, pp. 48-66, (1997)",7
"bourdieu p., la noblesse d'état, (1989)",7
"bourdieu p., rethinking the state",7
"bourdieu p., homo academicus, translated by peter collier, (1988)",7
"bourdieu p., programme for a sociology of sport, in other words: essays towards a reflexive sociology, pp. 156-167, (1990)",6
"bourdieu p., outline of a theory of practice cambridge, cambridge university press, (1977)",6
"bourdieu p., the school as a conservative force, contemporary research in the sociology of education, (1974)",6
"bourdieu p., chamboredon j.-c., passeron j.-c., le métier de sociologue. préalables épistémologiques, (1968)",6
"bourdieu p., the social space and the genesis of groups, social science information, 24, 2, pp. 195-220, (1985)",6
"bourdieu p., passeron j.-c., les héritiers, (1964)",6
"bourdieu p., le marché des biens symboliques, l'année sociologique, 22, pp. 49-126, (1971)",6
"bourdieu p., forms of capital, the routledgefalmer reader in sociology of education, (2004)",6
"bourdieu p., systems of education and systems of thought, knowledge and control, (1971)",6
"bourdieu p., structures, habitus, practices, the logic of practice, pp. 52-65, (1990)",6
"bourdieu p., the scholastic point of view, cultural anthropology, 5, 4, pp. 380-391, (1990)",6
"bourdieu p., haute couture and haute culture, sociology in question, pp. 132-138, (1993)",6
"bourdieu p., distinction",6
"bourdieu p., is a disinterested act possible?, practical reason: on the theory of action, (1998)",6
"bourdieu p., outline of a sociological theory of art perception, international social science journal, 20, pp. 589-612, (1968)",6
"bourdieu p., whiteside s., photography: a middle-brow art, (1996)",6
"bourdieu p., job insecurity is everywhere now, acts of resistance: against the tyranny of the market, pp. 81-87, (1998)",6
"bourdieu p., sayad a., uprooting: the crisis of traditional agriculture in algeria, (2020)",6
"bourdieu p., contre-feux. propos pour servir à la résistance contre l'invasion néo-libérale, (1998)",6
"bourdieu p., distinction, trans richard nice, (1984)",6
"bourdieu p., the forms of capital., education: culture, economy, and society, (1986)",6
"bourdieu p., passeron j.-c., saint-martin m., academic discourse, (1994)",6
"bourdieu p., distinction: a social critique of the judgement of taste. trans. r. nice, (1986)",6
"bourdieu p., wacquant l., from ruling class to field of power, theory, culture & society, 10, 3, pp. 19-44, (1993)",6
"bourdieu p., wacquant l., symbolic violence, violence in war and peace: an anthology, pp. 272-274, (2004)",6
"bourdieu p., (2000)",6
"bourdieu p., social space and the genesis of 'classes, language and symbolic power, pp. 229-251, (1991)",6
"bourdieu p., la misere du monde, (1993)",5
"bourdieu p., systems of education and systems of thought, knowledge and control: new directions for the sociology of education, pp. 189-207, (1971)",5
"bourdieu p., la production de la croyance: contribution à une économie des biens symboliques, actes de la recherche en sciences sociales, 13, pp. 3-43, (1977)",5
"bourdieu p., l’identite et la representation: elements pour une reflexion critique sur l’idée de région, actes de la recherche en sciences sociales, 35, pp. 63-71, (1980)",5
"bourdieu p., the attitude of the algerian peasant toward time, mediterranean countrymen: essays in the social anthropology of the mediterranean, (1963)",5
"bourdieu p., leçon sur la leçon, (1982)",5
"bourdieu p., epilogue: on the possibility of a field of world sociology, social theory for a changing society, pp. 373-387, (1991)",5
"bourdieu pierre, passeron jean-claude, reproduction in education, society and culture, (1990)",5
"bourdieu p., les régles de l'art, (1992)",5
"bourdieu p., outline of a sociological theory of art perception, the field of cultural production, pp. 215-239, (1993)",5
"bourdieu p., anthropologie économique. cours au collège de france 1992–1993, (2017)",5
"bourdieu p., the logic of practice, trans. r. nice, (1990)",5
"bourdieu p., wacquant l.j.d., the purpose of reflexive sociology, an invitation to reflexive sociology, pp. 61-215, (1992)",5
"bourdieu p., the forms of capital, the routledgefalmer reader in sociology of education, pp. 15-29, (1986)",5
"bourdieu p., social space and the genesis of appropriated physical space, international journal of urban and regional research, 42, 1, pp. 106-114, (2018)",5
"bourdieu p., distinction: a social critique of taste, (1984)",5
"bourdieu p., raisons pratiques, (1994)",5
"bourdieu p., champ du pouvoir et division du travail de domination, actes de la recherche en sciences sociales, 190, pp. 126-139, (2011)",5
"bourdieu p., the corporatism of the universal: the role of intellectuals in the modern world, telos, 21, 81, pp. 99-110, (1989)",5
"bourdieu p., sayad a., colonial rule and cultural sabir, ethnography, 5, 4, pp. 544-586, (2004)",5
"bourdieu p., the forms of capital, readings in economic sociology, (2001)",5
"bourdieu p., ökonomisches kapital, kulturelles kapital, soziales kapital, soziale welt sonderband, 2, pp. 183-198, (1983)",5
"bourdieu p., richardson j., the forms of capital, handbook of theory and research for the sociology of education, (1986)",5
"bourdieu p., a reasoned utopia and economic fatalism, new left review, 227, pp. 125-130, (1998)",5
"bourdieu p., boltanski l., la production de l'idéologie dominante, (2008)",5
"bourdieu p., richardson j.g., the forms of capital."" pp, handbook of theory and research for the sociology of education, pp. 241-258, (1986)",5
"bourdieu p., structures, habitus, power: basis for a theory of symbolic power, culture/power/history: a reader in contemporary social theory, pp. 155-199, (1994)",5
"bourdieu p., symbolic power, identity and structure: issues in the sociology of education, pp. 112-119, (1977)",5
"bourdieu p., wacquant l., the organic ethnologist of algerian migration, ethnography, 1, 2, pp. 173-182, (2000)",5
"bourdieu p., outline of a theory of practice, cambridge studies in social anthropology, 16, (1977)",5
"bourdieu p., algérie 60. structures économiques et structures temporelles, (1977)",5
"bourdieu p., how can one be a sportsman?, sociology in question, pp. 117-131, (1993)",5
"bourdieu p., sport and social class, information (international social science council), 17, 6, pp. 819-840, (1978)",5
"bourdieu p., photography: a middle-brow art, (1965)",5
"bourdieu p., boltanski l., castel r., chamboredon j.-c., un art moyen, essai sur les usages sociaux de la photographie, (1965)",5
