top_reference,total_count
"bourdieu p., lección sobre la lección, (2002)",1
"bourdieu p., darbel a., schnapper d., the love of art: european museums and their public, (1990)",1
"bourdieu p., desault y., introduction, actes de la recherche en sciences sociales, 40, pp. 10-49, (1981)",1
"bourdieu p., distinction: a social critique of the judgement of taste, handbook of theory and research for the sociology of education, pp. 241-258, (1986)",1
"bourdieu p., distinction (translated by r. nice), (1984)",1
"bourdieu p., die regeln der kunst, (1999)",1
"bourdieu p., le mort saisit le vif, actes de la recherche en sciences sociales, 32-33, pp. 3-14, (1980)",1
"bourdieu p., rethinking the state: the genesis of the bureaucratic field, sociological theory, 12, 1, pp. 1-18, (1994)",1
"bourdieu p., sozialer sinn, (1997)",1
"bourdieu p., a economia das trocas simbólicas [the symbolic changes economy], (2007)",1
"bourdieu p., passeron j.-c., os herdeiros: os estudantes e a cultura [the inheritors: french students and their relation to culture], (2014)",1
"bourdieu p., die verborgenen mechanismen der macht, (1992)",1
"bourdieu p., accardo a., (1999)",1
"bourdieu, codification",1
"bourdieu p., and loïcwacquant, (1992)",1
"bourdieu p., le nord et le midi: contribution une analyse de l'effet montesquieu, actes de la recherche en sciences sociales, 35, pp. 21-5, (1980)",1
"bourdieu p., in search of respect: selling crack in el barrio, (1996)",1
"bourdieu p., saint martin m.d., une classe objet' in 'la paysannerie': une classe objet, actes de recherche en sciences sociales, 17-18, pp. 2-5, (1977)",1
"bourdieu p., on the state: lectures at the collège de france, 1989 - 1992. edited by patrick champagne, remi lenoir, franck poupeau, and marie-christine rivière. translated by david fernbach., (2014)",1
"bourdieu p., the forms of capital, theory and society, 14, 6, pp. 723-744, (1986)",1
"bourdieu p., outline of a theory of practice (originally published in french 1972, trans. richard nice, (1977)",1
"bourdieu p., the field of cultural production: essays on art and literature, 37, pp. 251-252, (1993)",1
"bourdieu p., program for a sociology of sport, human kinetics journals, (2010)",1
"bourdieu p., sozialer raum und ›klassen‹. leçon sur la leçon, (1985)",1
"bourdieu p., gegenfeuer, (2004)",1
"bourdieu p., darbel a., et al., with dominique schnapper, the love of art: european art museums and their public",1
"bourdieu p., clisthène l’athénien, l’homme, 3, pp. 163-164, (1964)",1
"bourdieu p., sociologie générale, vol. 2. cours au collège de france (1983–1986) (general sociology, vol. 2. college of france lectures (1983–1986)), (2016)",1
"bourdieu p., the kabyle house or the world inversed, algeria 1960, pp. 133-153, (1979)",1
"bourdieu p., un acte désintéressé est-il possible?, raisons pratiques. sur la théorie de la raison, (1994)",1
"bourdieu p., la miseria del mondo, (2015)",1
"bourdieu p., la nouvelle vulgate planetaire, le monde diplomatique, pp. 1-7, (2000)",1
"bourdieu p., rites of institution. in:, language and symbolic power, pp. 117-126, (1991)",1
"bourdieu p., les rites d’institution comme acte d’institutions, actes de la recherche en sciences socials, (1982)",1
"bourdieu p., towards a reflexive sociology: a workshop interview conducted by loic wacquant, sociological theory, 7, 1, pp. 26-63, (1989)",1
"bourdieu pierre, the future of class and the causality of the probable, pp. 233-270, (1974)",1
"bourdieu pierre, other words, (1990)",1
"bourdieu pierre, is a disinterested act possible?, pp. 75-91, (1988)",1
"bourdieu p., la mort du sociologue erving goffman. le découvreur de l’infiniment petit, le monde, (1982)",1
"bourdieu p., public opinion does not exist, communication and class struggle: 1. capitalism and imperialism, pp. 124-130, (1979)",1
"bourdieu p., the logic of practice(trans: nice, r.), (1990)",1
"bourdieu p., the force of law, the hastings law journal, 38, pp. 814-853, (1987)",1
"bourdieu p., rethinking the state, sociological theory, 12, pp. 1-18, (1994)",1
"bourdieu p., wacquant l., an invitation to reflexive sociology, trans. l. wacquant, (1992)",1
"bourdieu p., the logic of practice, stanford university press, (1990)",1
"bourdieu p., the production of belief: contribution to an economy of symbolic goods, (1986)",1
"bourdieu p., the structure of the bureaucratic field, (1999)",1
"bourdieu p., granovetter m., swedberg r., the forms of capital, the sociology of economic life, (2001)",1
"bourdieu p., response to throop and murphy, anthropological theory, 2, (2002)",1
"bourdieu p., le sens de l'honneur: esquisse d'une théorie de la pratique précédé de trois études d'ethnologie kabyle., (1972)",1
"bourdieu p., boltanski l., castel p., chamboredon j.-c., lagneau g., schnapper d., photography: a middle-brow art, (1990)",1
"bourdieu p., sayad a., le déracinement, pp. 12-13, (1964)",1
"bourdieu p., le déracinement, pp. 36-37",1
"bourdieu p., the purpose of reflexive sociology, an invitation to reflexive sociology, (1992)",1
"bourdieu p., sport and social class, pp. 357-373, (1991)",1
"bourdieu p., halsey a.h., lauder h., brown p., wells a.s., the forms of capital, education, culture, economy and society, pp. 46-58, (1986)",1
"bourdieu p., bourdieu p., but who created the ""creators""?, sociology in question, pp. 139-148, (1993)",1
"bourdieu p., tanner j., outline of a sociological theory of art perception, the sociology of art: a reader, pp. 164-177, (2003)",1
"bourdieu p., carles p., gonzalez a., fregosi v., la sociologie est un sport de combat (sociology is a martial art), (2001)",1
"bourdieu p., passeron j.-c., la comparabilité des systèmes d'éducation, education, developpement et democratie, (1967)",1
"bourdieu p., darbel a., schnapper d., l'amour de l'art, les musées d'art et leur public, (1966)",1
"bourdieu p., l'état, l'économie et le sport, sociétés et représentations, 7, pp. 13-19, (1998)",1
"bourdieu p., sociologie de l'algérie, the algerians, (1958)",1
"bourdieu p., logique interne de la société algérienne tradition-nelle, le sous-développement, (1959)",1
"bourdieu p., le choc des civilisations, le sous-développement, (1959)",1
"bourdieu p., algeria 60. economic structures and temporal structures, (1979)",1
"bourdieu p., la réappropriation de la culture reniée, amour, phantasmes et société en afrique du nord et au sahara, (1992)",1
"bourdieu p., l'odyssée de la réappropriation, awal revue d’études berbères, 18, november, pp. 5-6, (1998)",1
"bourdieu p., entretien avec hafid adnani et tassadit yacine, awal, (2003)",1
"bourdieu p., habitus, habitus: a sense of place (2nd ed.), pp. 43-52, (2005)",1
"bourdieu p., wacquant l., an invitation to reflexive sociology, pp. 61-215, (1992)",1
"bourdieu p., culture and politics, distinction: a social critique of the judgement of taste, pp. 397-465, (1987)",1
"bourdieu p., the biographical illusion (l’illusion biographique), identity: a reader, pp. 297-303, (2004)",1
"bourdieu p., deux impérialismes de l'universel, l'amérique des français, edited by christine fauré, pp. 149-156, (1993)",1
"bourdieu p., the field of cultural production, the field of cultural production, (1993)",1
"bourdieu p., dolling i., steinrucke m., eine sanfte gewalt. pierre bourdieu im gespräch mit irene dölling und margareta steinrücke (märz 1994), ein alltägliches spiel. geschlechterkonstruktion in der sozialen praxis, pp. 218-230, (1997)",1
"bourdieu p., les stratégies de reproduction dans le systéme de reproduction, annales. économies, sociétés, civilisations, 4, 5, pp. 1105-1127, (1972)",1
"bourdieu p., education, globalization, and social change, pp. 105-118, (2006)",1
"bourdieu p., rethinking the state, pp. 9-10",1
"bourdieu p., social space and symbolic power, power: a reader, (2002)",1
"bourdieu p., social space and social power, power: a reader, pp. 229-44, (1989)",1
"bourdieu p., ce que parler veut dire, language and symbolic power, (1982)",1
"bourdieu p., a lecture on the lecture” in in other words: essays towards a reflexive sociology, (1982)",1
"bourdieu p., the ball of bachelors, (2006)",1
"bourdieu p., et al., l’économie de la maison. thematic double issue of actes de la recherche en sciences sociales, (1990)",1
"bourdieu p., fourth lecture. universal corporatism: the role of intellectuals in the modern world, poetics today, 12, 4, (1991)",1
"bourdieu p., raisons pratiques: sur la theorie de l’action (practical reason: on the theory of action), (1994)",1
"bourdieu p., wacquant l., per una sociologia reflexiva, (1992)",1
"bourdieu, the rise of professionalism: a sociological analysis, 23",1
"bourdieu p., bourdieu p., l’opinion publique n’existe pas, questions de sociologie, pp. 222-235, (1980)",1
"bourdieu p., bourdieu and the journalistic field, the political field, the social science field, and the journalistic field, pp. 29-47, (2005)",1
"bourdieu p., bourdieu p., social space and the genesis of classes, language and symbolic power, pp. 229-251, (1991)",1
"bourdieu p., structures and the habitus, outline of a theory of practice, pp. 72-95, (1977)",1
"bourdieu p., the forms of capital, in cultural theory: an anthology, 2011, pp. 81-93, (1986)",1
"bourdieu p., the forms of capital, blackwell readers in sociology, vol. 8: readings in economic sociology, (2002)",1
"bourdieu p., the forms of capital, transmission and reproduction, pp. 241-258, (1983)",1
"bourdieu p., la noblesse: capital social et capital symbolique, anciennes et nouvelles aristocraties de 1880 à nos jours, pp. 385-397, (2007)",1
"bourdieu p., derrida j., pour louis marin, liber: revue européenne des livres, 12, pp. 3-4, (1992)",1
"bourdieu p., the forms of social capital, the handbook of theory and research for the sociology of education, pp. 186-204, (1986)",1
"bourdieu p., razones prácticas., (1997)",1
"bourdieu p., meditaciones pascalianas, (1999)",1
"bourdieu p., el oficio de científico. ciencia de la ciencia y reflexividad, (2003)",1
"bourdieu p., the historical genesis of a pure aesthetics, the field of cultural production, pp. 254-267, (1993)",1
"bourdieu p., social spaces and genesis of 'classes, language and symbolic power, pp. 227-251, (1992)",1
"bourdieu pierre, clough lauretta c., the state nobility: elite schools in the field of power, (1996)",1
"bourdieu p., ‘the inheritors: french students and their relation to culture by pierre bourdieu and jean-claude passeron. translated by richard nice’, (1979)",1
"bourdieu p., reproduction in education, culture and society, (1977)",1
"bourdieu p., sayad a., (1964)",1
"bourdieu p., sobre a televisão, (1997)",1
"bourdieu p., contrafogos: táticasparaenfrentarainvasão neoliberal, (1998)",1
"bourdieu p., contrafogos 2, (2001)",1
"bourdieu p., structures, habitus, power: basis for a theory of symbolic power, culture/power/history, pp. 155-199, (1994)",1
"bourdieu p., for a sociology of sociologists, algerian sketches, (2013)",1
"bourdieu p., la théorie, vh, 101, 2, pp. 12-21, (1970)",1
"bourdieu p., in other words: essays toward a reflexive sociology, pp. 177-199, (1990)",1
"bourdieu p., the science of science and reflexivity [science de la science et réflexivité, cours au collège de france 2000-2001], (2004)",1
"bourdieu p., in other words: essays towards a reflexive sociology, repr. ed, (2004)",1
"bourdieu p., narzisstische reflexivität und wissenschaftliche reflexivität, kultur, soziale praxis, text, (1993)",1
"bourdieu p., foreword, professional competition and professional power: lawyers, accountants and the social construction of markets, (1995)",1
"bourdieu p., thinking about limits, cultural theory and cultural change, (1992)",1
"bourdieu p., passeron j.c., nice r., education, society and culture, (1977)",1
"bourdieu p., the berber house, rules and meanings, (1973)",1
"bourdieu p., o campo científico, pierre bourdieu, (1983)",1
"bourdieu p., espace physique, espace social et espace physique approprié, poverty, immigration and urban marginality in advanced societies, (1991)",1
"bourdieu p., efeitos de lugar, a miséria do mundo, (2003)",1
"bourdieu p., in other words: essays toward a reflexive social science., (1990)",1
"bourdieu p., la dissolution du religieux, pierre bourdieu. choses dites, pp. 117-123, (1987)",1
"bourdieu p., sociologues de la croyance et croyances de sociologies, c hoses dites, pp. 106-111, (1987)",1
"bourdieu p., sociologists of belief and beliefs of sociologists, nordic journal of religion and society, 23, 1, pp. 1-7, (2010)",1
"bourdieu p., las reglas del arte: génesis y estructura del campo literario, 167, (2002)",1
"bourdieu p., the forms of capital” edited by j. richardson, pp. 241-258, (1986)",1
"bourdieu, distinction, pp. 34-41",1
"bourdieu p., l’objectivation participante, actes de la recherche en sciences sociales, 150, 1, pp. 43-58, (2003)",1
"bourdieu p., meditationen. zur kritik der scholastischen vernunft [pascalian meditations], (1997)",1
"bourdieu p., cultural and social reproduction, social science information, 10, pp. 45-79, (1971)",1
"bourdieu p., travail et travailleurs en algérie [work and workers in algeria], (1963)",1
"bourdieu p., coleman j., moebius-strip organizations and open labor markets: consequences of the reintegration of conception and execution in a volatile economy, social theory for a changing society, pp. 23-53, (1991)",1
"bourdieu p., centrale tekster indenfor sociologi og kulturteori(central texts within sociology and cultural theory), (1994)",1
"bourdieu p., distinksjonen (distinction), (1995)",1
"bourdieu p., et steds betydning’ (themeaning of a place), symbolsk makt: artikler i utvalg (symbolic power: selectedarticles), pp. 149-158, (1996)",1
"bourdieu p., men hvem skabte skaberne? interviews ogforelæsninger (but who created the creators? interviews andlectures), (1997)",1
"bourdieu p., le sens pratique, edited by maison des sciences de l'homme, (1980)",1
"bourdieu p., réponses: pour une anthropologie réflexive, edited by loïc wacquant, (1992)",1
"bourdieu p., in other words: essays towards a reflexive sociology (translated by matthew adamson), (1990)",1
"bourdieu p., photography: a middle-brow art (translated by shaun whiteside), (1990)",1
"bourdieu p., acts of resistance: against the new myths of our time, (translated by richard nice), (1998)",1
"bourdieu p., principles of an economic anthropology, the handbook of economic sociology, edited by neil smelser and richard swedberg., (2005)",1
"bourdieu p., questions in sociology, (2005)",1
"bourdieu p., fourth lecture, universal corporatism: the role of intellectuals in the modern world, trans. g. sapiro and b. mchale, poetics today, 12, 4, pp. 655-669, (1991)",1
"bourdieu p., distinction. cambridge, (1984)",1
"bourdieu p., symbolsk makt, (1996)",1
"bourdieu p., habitus and field: general sociology vol. 2 (1982–82), (2020)",1
"bourdieu p., razões práticas: sobre a teoria da acção, (1997)",1
"bourdieu p., manet, une révolution symbolique. cours au collège de france 1998-2000, (2014)",1
"bourdieu p., france and the 1998 world cup: the national impact of a world sporting event, pp. 15-21, (1999)",1
"bourdieu p., how schools help reproduce the social order. current contents, social and behavioural science, 21, 8, (1989)",1
"bourdieu p., passeron j.-c., reproduktionen, (2008)",1
"bourdieu p., theory, culture and society series, 18, (1993)",1
"bourdieu p., social construction of economy, (2005)",1
"bourdieu p., sketch for a self-analysis, the empire strikes back: race and racism in 70s britain, (2008)",1
"bourdieu p., célibat et condition paysanne, etudes rurales, 5-6, april, pp. 32-136, (1962)",1
"bourdieu p., reproduction interdite. la crise de la société paysanne en béarn",1
"bourdieu p., masculine domination cambridge, (2001)",1
"bourdieu p., erving goffman: discoverer of the infinitely small, erving goffman, 1, pp. 1-4, (2000)",1
"bourdieu p., the forms of capital, handbook of research and theory for sociology of education, pp. 241-258, (1986)",1
"bourdieu p., idrottsutvning och idrottskonsumtion, kultur och kritik [culture and critique], pp. 189-211, (1997)",1
"bourdieu p., the forms of capital.” in handbook of theory and research for the sociology of education, edited by j. richardson, 241–258., (1986)",1
"bourdieu p., projet créateur et champ intellectuel, (1965)",1
"bourdieu p., séminaires sur le concept de champ, 1972–1975, (2013)",1
"bourdieu p., unwrapping the gift: on interest and generosity in social life, (1996)",1
"bourdieu p., la représentation politique – éléments pour une théorie du champ politique, actes de recherche en sciences sociales, 36-37, pp. 3-24, (1981)",1
"bourdieu p., las estrategias de la reproducción social, (2011)",1
"bourdieu p., public opinion does not exist, communication and class struggle: an anthology in 2 volumes, pp. 124-130, (1979)",1
"bourdieu p., pratiques sportives et pratiques sociales, 7ème congrès international de l'association internationale de l'histoire de l'éducation physique et du sport, pp. 17-37, (1978)",1
"bourdieu p., quelques proprits des champs, questions de sociologie, (1984)",1
"bourdieu p., l'illusion bibliographique, actes de la recherche, 62, 63, pp. 69-72, (1986)",1
"bourdieu p., structures, habitus, practices, rethinking the subject, an anthology of contemporary european thought, pp. 31-45, (1995)",1
"bourdieu p., over televisie, (1998)",1
"bourdieu b., reynard j.-d., is a sociology of action possible?, positivism and sociology, pp. 101-114, (1974)",1
"bourdieu p., célibat et condition paysanne, (1962)",1
"bourdieu p., un art moyen: les usages sociaux de la photographie, (1965)",1
"bourdieu p., l’amour de l'art, (1966)",1
"bourdieu p., condition de classe et position de classe, (1966)",1
"bourdieu p., une sociologie de l'action est-elle possible?, (1966)",1
"bourdieu p., champ intellectuel et projet créateur, (1966)",1
"bourdieu p., postface to and translation of e. panofsky, gothic architecture and scholastic thought, (1967)",1
"bourdieu p., systèmes d'enseignement et systèmes de pensée, (1967)",1
"bourdieu p., eléments d'une théorie sociologique de la perception artistique, (1968)",1
"bourdieu p., la reproduction: éléments pour une théorie du système d'enseignement, (1970)",1
"bourdieu p., la maison kabyle ou le monde renversé, (1970)",1
"bourdieu p., une interprétation de la théorie de la religion selon max weber, (1971)",1
"bourdieu p., genèse et structure du champ religieux, (1971)",1
"bourdieu p., l’opinion publique n'existe pas, (1971)",1
"bourdieu p., tout est social, (1992)",1
"bourdieu p., academic discourse: linguistic misunderstanding and professional power, (2000)",1
"bourdieu p., método científico e hierarquia social dos objetos, escritos de educação, pp. 33-38, (2007)",1
"bourdieu p., chamboredon j.c., passeron j.c., el oficio del sociólogo, presupuestos epistemológicos. siglo xxi editores., (2002)",1
"bourdieu p., readings in economic sociology, pp. 280-291, (1986)",1
"bourdieu p., the forms of capital, translated by r nice, handbook of theory of research for the sociology of education, pp. 241-258, (1986)",1
"bourdieu p., 1988. homo academicus. translated by peter collier, (1984)",1
"bourdieu p., sociology in question, work, self and society. after industrialism, (1993)",1
"bourdieu p., jean-claude p., 1990. reproduction in education, society and culture. london: sage, (1977)",1
"bourdieu p., la rue des jonquilles, la misère du monde, pp. 13-32, (1993)",1
"bourdieu p., la distinción. crítica social del juicio (the distinction. social criticism of the trial), (1989)",1
"bourdieu p., how can one be a sports fan?, empiria, 30, (1993)",1
"wacquant l.j.d., towards a reflexive sociology: a workshop with pierre bourdieu, an invitation to reflexive sociology, pp. 26-63, (1992)",1
"bourdieu p., propos sur le champ politique (notes on the political field), (2000)",1
"bourdieu p., rethinking popular culture. contemporary perspectives in cultural studies, pp. 357-373, (1991)",1
"bourdieu pierre, sociologie générale, vol. 2. cours au collège de france (1983–1986), (2017)",1
"bourdieu pierre, the field of power and the division of the labour of domination, researching elites and power: theory, methods, analyses, pp. 33-44, (2020)",1
"bourdieu p., genèse et structure du champs religieux [genesis and structure of the religious field], revue française de sociologie, 12, pp. 295-334, (1971)",1
"bourdieu p., the economy of linguistic exchanges, language and symbolic power, pp. 37-90, (1991)",1
"bourdieu p., darbel a., rivet j.-p., seibel c., travail et travailleurs en algérie (work and workers in algeria), (1963)",1
"bourdieu p., the forms of capital, theory and research for the sociology of education, (1986)",1
"bourdieu p., ‘the forms of capital’, pp, handbook of research and theory for sociology of education, (1986)",1
"bourdieu p., masculine domination revisited. the goffman prize lecture, berkeley journal of sociology, 41, pp. 189-203, (1977)",1
"bourdieu p., pour une sociologie des formes symboliques, (1970)",1
"bourdieu p., sullo stato. corso al collège de france volume 1 (1989-1990), (2013)",1
"bourdieu p., max weber, rationality and modernity, pp. 119-136, (1987)",1
"bourdieu p., the forms of capital, handbook of theory for the sociology of education, (1986)",1
"bourdieu p., language & symbolic power, on symbolic power, (1991)",1
"bourdieu p., capital symbolique et classes sociales, l'arc, 72, pp. 13-19, (1978)",1
"bourdieu p., effet de champ et effet de corps, actes de la recherche en sciences sociales, 59, (1985)",1
"bourdieu p., postface to the craft of sociology: epistemological preliminaries, pp. 247-260, (1968)",1
"bourdieu p., originally published in 2004 as esquisse pour une auto-analyse, sketch for a self analysis, (2007)",1
"bourdieu p., [1971]), ‘legitimation and structured interests in weber’s sociology of religion’, in s. lash and s. whimster (eds), max weber, rationality, and modernity, pp. 119-136, (1987)",1
"bourdieu p., de saint martin m., la sainte famille: lépiscopat français dans le champ du pouvoir, pp. 44-45, (1982)",1
"bourdieu p., the aristocracy of culture, media culture and sociology.a critical reader, (1986)",1
"bourdieu p., principles of economic anthropology, handbook of economic anthropology, (2005)",1
"bourdieu p., physischer, sozialer und angeeigneter physischer raum, stadt-räume, pp. 25-34, (1991)",1
"bourdieu p., razones prácticas: sobre lateoría de la acción [practical reason: on the theory ofaction], (1999)",1
"bourdieu p., [1985]) sociology in question, (2000)",1
"bourdieu p., [1996]). 'the myth of ""globalization"" and the european welfare state, sociology is a martial art: political writings by pierre bourdieu, (2010)",1
"bourdieu andwacquant p.l., (1992)",1
"bourdieu p., wacquant l., towards a reflexive sociology, sociological theory, 7, (1989)",1
"bourdieu p., the berber house, the anthropology of space, pp. 131-141, (2003)",1
"bourdieu pierre, wacquant loic, symbolic violence, violence in war and peace, pp. 272-274, (2004)",1
"bourdieu p., de regels van de kunst. wording en structuur van het literaire veld. [dutch translation of les règles de l'art. genèse et structure du champ littéraire], (1994)",1
"bourdieu p., algeria 1960: the kabyle house or the world reversed, (1979)",1
"bourdieu p., political representation: elements for a theory of the political field, pp. 171-202, (1991)",1
"bourdieu, forms of capital, pp. 46-58",1
"bourdieu, rethinking the state, pp. 57-58",1
"bourdieu, political representation, pp. 173-174",1
"bourdieu p., passeron j.c., le métier de sociologue, (1968)",1
"bourdieu p., delsaut y., pour une sociologie de la perception [for a sociology of perception], actes de la recherche en sciences sociales, 40, pp. 3-9, (1981)",1
"bourdieu p., wacquant l., for a socio-analysis of intellectuals: on homo academicus, berkeley journal of sociology, 34, pp. 1-29, (1989)",1
"bourdieu p., on interest and the relative autonomy of symbolic power., (1988)",1
"bourdieu p., the social institution of symbolic power, language and symbolic power, pp. 103-126, (1991)",1
"bourdieu p., on television, the forms of capital, pp. 46-58, (1996)",1
"bourdieu p., cultural reproduction and social reproduction, knowledge, education and social change, richard harvey brown, (1973)",1
"bourdieu p., the market of symbolic goods, the field of cultural production, pp. 112-141, (1993)",1
"bourdieu p., outline of a theory of practice, translation by r, cambridge university press, (1977)",1
"bourdieu p., distinction: a social critique of the judgement of taste, translation by r, harvard university press, (1984)",1
"bourdieu pierre, the weight of the world: social suffering in contemporary society, (2000)",1
"bourdieu p., language and symbolic power, the discourse reader, pp. 480-490, (1999)",1
"bourdieu p., preface to the english language edition, distinction: a social critique of the judgement of taste, (2000)",1
"bourdieu p., the forms of capital, education, globalisation and social change, (2006)",1
"bourdieu p., deux impérialismes de l'universel, l'amérique des français., (1992)",1
"bourdieu p., contre-feux: propos sur le capitalisme sauvage, acts of resistance: against the tyranny of the market., (1998)",1
"bourdieu p., le hantise du chômage chez l'ouvrier algérien: prolétariat et système coloniale, sociologie du travail, 4, pp. 313-331, (1962)",1
"bourdieu p., formes et degrés de la conscience du chômage dans l'algérie coloniale, manpower and unemployment research in africa, 4, pp. 36-44, (1971)",1
"bourdieu p., das religiöse feld: texte zur ökonomie des heilgeschehens, (2000)",1
"bourdieu p., lebaron f., un entretien avec pierre bourdieu et frédéric lebaron: et si on repensait l'économie?, le nouvel observateur, (2000)",1
